product_id,product_name,unit_cost,category,MOQ,lead_time_days
21774,DECORATIVE CATS BATHROOM BOTTLE,2.46,Toys,24,5
22342,HOME GARLAND PAINTED ZINC ,3.29,Gifts,17,3
22363,GLASS JAR MARMALADE ,5.79,Stationery,26,6
22372,AIRLINE BAG VINTAGE WORLD CHAMPION ,8.29,Gifts,21,5
71053,WHITE METAL LANTERN,8.29,Stationery,24,4
71459,HANGING JAM JAR T-LIGHT HOLDER,1.66,Gifts,23,3
21932,SCANDINAVIAN PAISLEY PICNIC BAG,5.79,Gifts,28,2
21972,SET OF 36 DINOSAUR PAPER DOILIES,2.92,Home,11,5
22390,PAPERWEIGHT CHILDHOOD MEMORIES,4.96,Stationery,13,3
22497,SET OF 2 TINS VINTAGE BATHROOM ,8.29,Home,16,2
22534,MAGIC DRAWING SLATE SPACEBOY ,0.83,Toys,17,2
22556,PLASTERS IN TIN CIRCUS PARADE ,3.29,Toys,26,3
22613,PACK OF 20 SPACEBOY NAPKINS,1.63,Stationery,24,2
22745,POPPY'S PLAYHOUSE BEDROOM ,4.13,Toys,20,6
22817,CARD SUKI BIRTHDAY,0.83,Home,24,5
22863,SOAP DISH BROCANTE,5.79,Stationery,15,4
22912,YELLOW COAT RACK PARIS FASHION,10.79,Toys,29,5
22701,PINK DOG BOWL,5.79,Gifts,27,2
22729,ALARM CLOCK BAKELIKE ORANGE,7.46,Home,14,2
22254,FELT TOADSTOOL LARGE,2.46,Toys,16,5
22255,FELT TOADSTOOL  SMALL,1.63,Stationery,23,2
20763,DAISY SKETCHBOOK ,7.46,Toys,16,4
20828,GLITTER BUTTERFLY CLIPS,4.96,Toys,18,2
20839,FRENCH PAISLEY CUSHION COVER ,9.13,Toys,10,3
20967,GREY FLORAL FELTCRAFT SHOULDER BAG,7.46,Gifts,17,4
21171,BATHROOM METAL SIGN ,3.29,Stationery,24,6
21520,BOOZE & WOMEN GREETING CARD ,0.83,Stationery,24,5
90123B,TURQUOISE HEART OF GLASS BRACELET,5.82,Home,25,4
90174,BUTTERFLY HAIR BAND,2.48,Stationery,15,2
DOT,DOTCOM POSTAGE,214.42,Gifts,12,5
84527,FLAMES SUNGLASSES PINK LENSES,1.95,Home,23,2
72799C,PINK PILLAR CANDLE SILVER FLOCK,2.95,Toys,25,4
85212,MINI PAINTED GARDEN DECORATION ,0.85,Stationery,25,2
71101E,STANDING FAIRY POLE SUPPORT ,0.85,Gifts,27,5
21457,2 PICTURE BOOK EGGS EASTER DUCKS,1.25,Home,14,3
90072,RUBY DROP CHANDELIER EARRINGS,3.75,Gifts,16,6
90073,VINTAGE ENAMEL & CRYSTAL EARRINGS,4.95,Home,22,4
79191D,RETRO PLASTIC DAISY TRAY,0.85,Stationery,27,4
72134,COLUMBIAN  CUBE CANDLE ,0.85,Stationery,11,6
21456,2 PICTURE BOOK EGGS EASTER CHICKS,1.25,Toys,22,5
21317,GLASS SPHERE CANDLE STAND MEDIUM,5.45,Gifts,25,2
35647,VINTAGE BEAD PINK SHADE ,1.25,Toys,10,4
22215,CAKE STAND WHITE TWO TIER LACE,7.65,Toys,20,4
90214G,"LETTER ""G"" BLING KEY RING",1.25,Stationery,13,6
82551,LAUNDRY 15C METAL SIGN,1.25,Home,23,6
21932,SCANDINAVIAN PAISLEY PICNIC BAG,2.55,Gifts,29,6
47570B,TEA TIME TABLE CLOTH,8.49,Gifts,14,5
21408,SPOTTY PINK DUCK DOORSTOP,8.29,Stationery,25,5
21485,RETROSPOT HEART HOT WATER BOTTLE,10.79,Stationery,11,5
21846,PINK DIAMANTE PEN IN GIFT BOX,4.13,Gifts,22,2
21935,SUKI  SHOULDER BAG,3.29,Stationery,23,4
22025,RING OF ROSES BIRTHDAY CARD,0.83,Toys,18,6
22106,MIRROR MOSAIC HURRICANE LAMP ,4.96,Home,23,5
22152,PLACE SETTING WHITE STAR,1.63,Toys,20,2
21060,PARTY INVITES BALLOON GIRL,1.63,Home,10,2
20685,DOORMAT RED RETROSPOT,7.46,Home,27,4
20893,HANGING BAUBLE T-LIGHT HOLDER SMALL,4.96,Gifts,21,3
21033,JUMBO BAG CHARLIE AND LOLA TOYS,5.79,Home,29,2
22315,200 RED + WHITE BENDY STRAWS,2.46,Home,23,4
22317,FIVE CATS HANGING DECORATION,5.79,Home,22,3
22513,DOORSTOP FOOTBALL DESIGN,7.46,Home,21,6
84945,MULTI COLOUR SILVER T-LIGHT HOLDER,1.8,Stationery,21,4
85114B,IVORY ENCHANTED FOREST PLACEMAT,3.29,Home,26,6
DOT,DOTCOM POSTAGE,144.45,Stationery,28,6
21625,VINTAGE UNION JACK APRON,14.13,Home,17,5
21706,FOLDING UMBRELLA RED/WHITE POLKADOT,9.96,Stationery,23,2
21775,DECORATIVE FLORE BATHROOM BOTTLE,2.46,Gifts,18,4
21883,STARS GIFT TAPE ,1.63,Stationery,25,5
85170D,SET/6 PINK BIRD T-LIGHT CANDLES,4.13,Stationery,19,4
90125E,AMBER BERTIE GLASS BEAD BAG CHARM,4.13,Stationery,25,5
DOT,DOTCOM POSTAGE,105.71,Toys,17,2
22211,WOOD STAMP SET FLOWERS,3.29,Home,25,6
22367,CHILDRENS APRON SPACEBOY DESIGN,4.13,Toys,22,2
22861,EASTER TIN CHICKS IN GARDEN,3.29,Gifts,12,6
37448,CERAMIC CAKE DESIGN SPOTTED MUG,3.29,Gifts,24,4
72807C,SET/3 VANILLA SCENTED CANDLE IN BOX,8.29,Gifts,14,4
79066K,RETRO MOD TRAY,1.63,Toys,12,6
82483,WOOD 2 DRAWER CABINET WHITE FINISH,12.46,Toys,18,5
84596B,SMALL DOLLY MIX DESIGN ORANGE BOWL,2.46,Home,21,6
84638,SMALL KITCHEN FLOWER POTS PLAQUE,14.13,Toys,26,5
84884A,ANT WHITE WIRE HEART SPIRAL,8.29,Toys,20,6
22725,ALARM CLOCK BAKELIKE CHOCOLATE,7.46,Home,12,5
22794,SWEETHEART WIRE MAGAZINE RACK,15.79,Gifts,14,4
21401,BLUE PUDDING SPOON,0.83,Stationery,13,5
21933,PINK VINTAGE PAISLEY PICNIC BAG,5.79,Home,19,3
22134,MINI LADLE LOVE HEART RED ,0.83,Home,17,3
22963,JAM JAR WITH GREEN LID,1.63,Stationery,10,3
37342,POLKADOT COFFEE CUP & SAUCER PINK,5.79,Stationery,27,6
84792,ENCHANTED BIRD COATHANGER 5 HOOK,9.13,Toys,12,4
84916,HAND TOWEL PALE BLUE W FLOWERS,4.13,Stationery,29,3
85187,S/12 MINI RABBIT EASTER,3.29,Stationery,10,2
DOT,DOTCOM POSTAGE,127.09,Home,15,5
72819,CUPID DESIGN SCENTED CANDLES,2.1,Stationery,12,6
20725,LUNCH BAG RED RETROSPOT,4.96,Stationery,25,6
21059,PARTY INVITES DINOSAURS,1.63,Home,28,4
21232,STRAWBERRY CERAMIC TRINKET BOX,3.29,Gifts,29,6
21679,SKULLS  STICKERS,1.63,Toys,26,2
21992,VINTAGE PAISLEY STATIONERY SET,5.79,Home,21,3
22476,EMPIRE UNION JACK TV DINNER TRAY,10.79,Home,18,5
22776,SWEETHEART CAKESTAND 3 TIER,19.96,Home,11,2
84992,72 SWEETHEART FAIRY CAKE CASES,2.08,Toys,12,4
85071A,BLUE CHARLIE+LOLA PERSONAL DOORSIGN,5.79,Home,27,2
DOT,DOTCOM POSTAGE,161.08,Gifts,21,5
84872a,TEATIME FUNKY FLOWER BACKPACK FOR 2,10.79,Gifts,17,6
22381,TOY TIDY PINK POLKADOT,4.96,Home,29,4
DOT,DOTCOM POSTAGE,80.46,Gifts,14,3
22938,CUPCAKE LACE PAPER SET 6,1.65,Stationery,29,3
70006,LOVE HEART POCKET WARMER,1.25,Home,26,6
22763,KEY CABINET MA CAMPAGNE,8.5,Gifts,10,5
46775D,SUNSET COLOUR CHUNKY KNITTED THROW,16.95,Stationery,26,3
84789,ENCHANTED BIRD PLANT CAGE,2.95,Home,11,3
22860,EASTER TIN CHICKS PINK DAISY,3.29,Toys,20,5
22933,BAKING MOULD EASTER EGG MILK CHOC,5.79,Stationery,14,5
35915C,PEACH KNITTED HEN ,3.29,Home,28,3
47480,HANGING PHOTO CLIP ROPE LADDER,3.29,Stationery,14,4
72351B,SET/6 PINK  BUTTERFLY T-LIGHTS,4.13,Home,16,4
72800C,4 PINK DINNER CANDLE SILVER FLOCK,4.96,Gifts,11,5
85111,SILVER GLITTER FLOWER VOTIVE HOLDER,2.46,Stationery,25,2
85202,HANGING WOOD AND FELT HEART,0.79,Gifts,27,6
90051,CRACKED GLAZE NECKLACE RED,7.07,Stationery,16,6
DOT,DOTCOM POSTAGE,163.67,Home,24,4
22059,CERAMIC STRAWBERRY DESIGN MUG,3.29,Toys,25,2
22068,BLACK PIRATE TREASURE CHEST,3.29,Home,12,3
22073,RED RETROSPOT STORAGE JAR,7.46,Gifts,21,5
21407,BROWN CHECK CAT DOORSTOP ,8.29,Stationery,15,3
20652,BLUE POLKADOT LUGGAGE TAG ,2.46,Stationery,13,3
21454,PAINTED PINK RABBIT ,1.63,Home,26,5
22322,BIRD DECORATION GREEN POLKADOT,1.63,Stationery,20,2
22473,TV DINNER TRAY VINTAGE PAISLEY,10.79,Toys,21,3
22479,DAISY GARDEN MARKER,2.46,Home,12,6
22487,WHITE WOOD GARDEN PLANT LADDER,19.96,Home,21,4
22498,WOODEN REGATTA BUNTING,12.46,Toys,23,6
22609,PENS ASSORTED SPACEBALL,1.63,Gifts,10,2
22610,PENS ASSORTED FUNNY FACE,1.63,Toys,27,6
22618,COOKING SET RETROSPOT,19.96,Toys,22,2
22185,SLATE TILE NATURAL HANGING,3.29,Home,17,2
22228,BUNNY WOODEN PAINTED WITH BIRD ,1.63,Toys,20,2
22248,DECORATION  PINK CHICK MAGIC GARDEN,1.63,Toys,18,6
22249,DECORATION WHITE CHICK MAGIC GARDEN,1.63,Stationery,15,4
22280,POCKET BAG PINK PAISELY BROWN SPOT,2.46,Toys,11,5
22293,HANGING CHICK GREEN DECORATION,2.92,Gifts,19,4
22312,OFFICE MUG WARMER POLKADOT,5.79,Home,19,3
22313,OFFICE MUG WARMER PINK,5.79,Home,19,3
21746,SMALL RED RETROSPOT WINDMILL,2.46,Stationery,13,5
21749,LARGE RED RETROSPOT WINDMILL,4.13,Stationery,19,5
21758,VINTAGE SHELLS PRINT,12.46,Toys,26,3
20803,SMALL PINK GLASS SUNDAE DISH,3.29,Stationery,21,4
21108,FAIRY CAKE FLANNEL ASSORTED COLOUR,4.96,Home,23,6
21507,"ELEPHANT, BIRTHDAY CARD, ",0.83,Home,23,5
21688,SILVER PLATE CANDLE BOWL SMALL,5.79,Home,26,6
21695,SMALL SILVER FLOWER CANDLE POT,5.79,Gifts,15,3
21709,FOLDING UMBRELLA CHOCOLATE POLKADOT,9.96,Home,21,6
21980,PACK OF 12 RED RETROSPOT TISSUES ,0.83,Gifts,10,6
22027,TEA PARTY BIRTHDAY CARD,0.36,Home,19,2
47503H,ASS FLORAL PRINT SPIRIT LEVEL ,4.13,Stationery,27,2
47566B,TEA TIME PARTY BUNTING,10.79,Stationery,27,4
22251,BIRDHOUSE DECORATION MAGIC GARDEN,2.46,Gifts,26,2
90160D,PINK BOUDICCA LARGE BRACELET,7.07,Stationery,21,2
90185A,AMBER DIAMANTE EXPANDABLE RING,4.15,Gifts,10,3
90185B,AMETHYST DIAMANTE EXPANDABLE RING,4.15,Gifts,23,4
22286,"DECORATION , WOBBLY RABBIT , METAL ",3.29,Toys,18,3
15056BL,EDWARDIAN PARASOL BLACK,12.46,Toys,14,4
20846,ZINC HEART LATTICE T-LIGHT HOLDER,2.46,Toys,11,3
22325,MOBILE VINTAGE HEARTS ,11.63,Home,22,6
22465,HANGING METAL STAR LANTERN,3.29,Gifts,23,2
22677,FRENCH BLUE METAL DOOR SIGN 2,2.46,Home,28,6
22819,"BIRTHDAY CARD, RETRO SPOT",0.83,Home,10,2
22834,HAND WARMER BABUSHKA DESIGN,4.13,Stationery,19,4
21262,WHITE GOOSE FEATHER CHRISTMAS TREE ,7.46,Home,12,2
90190A,SILVER/CRYSTAL DROP EARRINGS W LEAF,2.9,Stationery,25,3
90201A,PURPLE ENAMEL FLOWER RING,2.9,Home,20,5
90201B,BLACK ENAMEL FLOWER RING,2.9,Home,15,6
90201C,RED ENAMEL FLOWER RING,2.9,Home,27,4
DOT,DOTCOM POSTAGE,124.16,Stationery,13,3
90000B,MIDNIGHT BLUE COPPER FLOWER NECKLAC,6.23,Stationery,14,2
90160A,PURPLE BOUDICCA LARGE BRACELET,7.07,Gifts,23,4
90160B,RED BOUDICCA LARGE BRACELET,7.07,Stationery,18,3
90160C,TURQ+RED BOUDICCA LARGE BRACELET,7.07,Toys,14,5
21631,HIPPY CHIC DECORATIVE PARASOL,12.75,Stationery,20,5
20795,LARGE BLUE PROVENCAL CERAMIC BALL,2.1,Stationery,21,4
84976,RECTANGULAR SHAPED MIRROR,1.69,Stationery,29,5
84800M,MEDIUM WHITE/PINK ROSE ART FLOWER,1.27,Stationery,16,2
84632,DECORATIVE HANGING SHELVING UNIT,59.95,Gifts,19,6
22257,FELT FARM ANIMAL SHEEP,1.25,Stationery,28,6
90197B,BLACK GLASS BRACELET W HEART CHARMS,4.95,Home,29,6
22193,RED DINER WALL CLOCK,16.63,Toys,13,3
79321,CHILLI LIGHTS,10.79,Toys,29,6
84987,SET OF 36 TEATIME PAPER DOILIES,3.75,Toys,22,2
DOT,DOTCOM POSTAGE,150.25,Toys,15,2
84988,SET OF 72 PINK HEART PAPER DOILIES,3.75,Stationery,24,5
72801c,4 ROSE PINK DINNER CANDLES,2.46,Stationery,14,5
22405,MONEY BOX POCKET MONEY DESIGN,2.46,Gifts,23,3
22090,PAPER BUNTING RETROSPOT,6.63,Home,16,5
21210,SET OF 72 RETROSPOT PAPER  DOILIES,3.75,Stationery,11,3
21974,SET OF 36 PAISLEY FLOWER DOILIES,3.75,Gifts,26,4
85175,CACTI T-LIGHT CANDLES,13.29,Gifts,10,2
20831,GOLD PHOTO FRAME,4.13,Gifts,20,3
22256,FELT FARM ANIMAL CHICKEN,2.46,Toys,22,5
22685,FRENCH BLUE METAL DOOR SIGN 0,2.46,Stationery,11,4
22683,FRENCH BLUE METAL DOOR SIGN 8,2.46,Stationery,29,3
22754,SMALL RED BABUSHKA NOTEBOOK ,1.63,Toys,17,5
84755,COLOUR GLASS T-LIGHT HOLDER HANGING,1.24,Toys,17,4
84813,SET OF 4 DIAMOND NAPKIN RINGS,24.96,Toys,11,6
21879,HEARTS GIFT TAPE,1.63,Home,19,6
21891,TRADITIONAL WOODEN SKIPPING ROPE,2.46,Home,19,6
21907,I'M ON HOLIDAY METAL SIGN,4.13,Toys,14,5
22529,MAGIC DRAWING SLATE GO TO THE FAIR ,0.83,Stationery,17,6
22531,MAGIC DRAWING SLATE CIRCUS PARADE  ,0.83,Home,23,4
22536,MAGIC DRAWING SLATE PURDEY,0.83,Stationery,25,6
21633,SUNFLOWER DECORATIVE PARASOL,24.96,Home,10,6
22537,MAGIC DRAWING SLATE DINOSAUR,0.83,Home,13,5
22597,MUSICAL ZINC HEART DECORATION ,1.63,Toys,24,4
22468,BABUSHKA LIGHTS STRING OF 10,13.29,Stationery,19,6
22258,FELT FARM ANIMAL RABBIT,2.46,Toys,16,2
22314,OFFICE MUG WARMER CHOC+BLUE,5.79,Home,12,5
22375,AIRLINE BAG VINTAGE JET SET BROWN,8.29,Gifts,12,6
21422,PORCELAIN ROSE SMALL,1.63,Home,29,4
22764,"RUSTIC WOODEN CABINET, GLASS DOORS",49.96,Gifts,17,5
22795,SWEETHEART RECIPE BOOK STAND,13.29,Home,21,3
22903,CALENDAR FAMILY FAVOURITES,5.79,Gifts,11,5
22931,BAKING MOULD HEART WHITE CHOCOLATE,4.96,Toys,17,3
90120A,PINK MURANO TWIST BRACELET,4.25,Home,24,4
90120B,BLUE MURANO TWIST BRACELET,4.15,Stationery,13,6
90120C,GREEN MURANO TWIST BRACELET,4.15,Toys,12,6
90214E,"LETTER ""E"" BLING KEY RING",0.83,Toys,23,4
DOT,DOTCOM POSTAGE,216.11,Toys,13,5
85015,SET OF 12  VINTAGE POSTCARD SET,2.46,Toys,11,5
85088,CANDY SPOT HAND BAG,4.13,Stationery,20,5
90037A,TINY CRYSTAL BRACELET RED,2.48,Toys,20,5
22939,APRON APPLE DELIGHT,10.79,Home,22,3
90125C,TURQUOISE BERTIE GLASS BEAD CHARM,0.85,Stationery,23,5
22663,JUMBO BAG DOLLY GIRL DESIGN,1.65,Gifts,25,6
21257,VICTORIAN SEWING BOX MEDIUM,6.95,Gifts,12,5
21407,BROWN CHECK CAT DOORSTOP ,3.75,Toys,10,2
35913B,WHITE/PINK CHICK EASTER DECORATION,0.85,Toys,22,3
22146,EASTER CRAFT IVY WREATH WITH CHICK,1.95,Toys,28,3
21519,GIN & TONIC DIET GREETING CARD ,0.36,Stationery,17,5
22627,MINT KITCHEN SCALES,7.65,Home,16,4
85047,WHITE BEADED GARLAND STRING 20LIGHT,6.35,Home,22,6
21670,BLUE SPOT CERAMIC DRAWER KNOB,3.29,Stationery,28,3
21671,RED SPOT CERAMIC DRAWER KNOB,3.29,Stationery,11,5
22498,WOODEN REGATTA BUNTING,8.29,Gifts,21,5
22728,ALARM CLOCK BAKELIKE PINK,8.29,Stationery,26,6
22729,ALARM CLOCK BAKELIKE ORANGE,8.29,Stationery,13,6
84989a,75 GREEN FAIRY CAKE CASES,2.08,Gifts,27,4
47570b,TEA TIME TABLE CLOTH,20.79,Home,24,6
21988,PACK OF 6 SKULL PAPER PLATES,1.63,Gifts,10,4
22374,AIRLINE BAG VINTAGE JET SET RED,8.29,Stationery,18,2
22509,SEWING BOX RETROSPOT DESIGN ,33.33,Gifts,25,3
22645,CERAMIC HEART FAIRY CAKE MONEY BANK,4.13,Toys,18,4
85049e,SCANDINAVIAN REDS RIBBONS,3.29,Stationery,13,5
DOT,DOTCOM POSTAGE,247.54,Home,27,6
21476,STEEL SWEETHEART ROUND TABLE CREAM,14.95,Home,24,5
22183,CAKE STAND VICTORIAN FILIGREE MED,5.95,Stationery,26,3
37351,ORANGE FLOWER MUG ,1.25,Stationery,22,2
85160A,WHITE BIRD GARDEN DESIGN MUG,1.25,Home,13,4
21988,PACK OF 6 SKULL PAPER PLATES,0.64,Toys,25,3
16052,TEATIME PUSH DOWN RUBBER,0.42,Stationery,27,5
72815,3 WICK CHRISTMAS BRIAR CANDLE ,3.75,Home,26,2
21623,VINTAGE UNION JACK MEMOBOARD,8.5,Toys,26,5
21617,4 LILY  BOTANICAL DINNER CANDLES,3.25,Stationery,23,3
21588,RETROSPOT GIANT TUBE MATCHES,2.1,Stationery,27,4
20986,BLUE CALCULATOR RULER,2.46,Gifts,12,2
21977,PACK OF 60 PINK PAISLEY CAKE CASES,2.08,Toys,25,3
84378,SET OF 3 HEART COOKIE CUTTERS,3.29,Stationery,22,6
84997a,GREEN 3 PIECE POLKADOT CUTLERY SET,8.29,Stationery,16,5
85039a,SET/4 RED MINI ROSE CANDLE IN BOWL,3.29,Stationery,10,5
37333,"RETRO ""TEA FOR ONE"" ",10.79,Gifts,13,6
DOT,DOTCOM POSTAGE,200.38,Gifts,12,4
22854,CREAM SWEETHEART EGG HOLDER,4.25,Home,12,5
22934,BAKING MOULD EASTER EGG WHITE CHOC,5.79,Home,19,4
82613B,"METAL SIGN,CUPCAKE SINGLE HOOK",2.46,Toys,28,4
84968C,SET OF 16 VINTAGE PISTACHIO CUTLERY,24.96,Toys,13,3
85173,SET/6 FROG PRINCE T-LIGHT CANDLES,4.96,Toys,12,4
85232D,SET/3 DECOUPAGE STACKING TINS,9.96,Gifts,11,4
21947,SET OF 6 HEART CHOPSTICKS,2.46,Home,13,6
22081,RIBBON REEL FLORA + FAUNA ,3.29,Toys,10,6
DOT,DOTCOM POSTAGE,246.37,Home,13,3
22268,EASTER DECORATION SITTING BUNNY,1.63,Toys,20,6
22299,PIG KEYRING WITH LIGHT & SOUND ,2.46,Toys,29,3
22311,OFFICE MUG WARMER BLACK+SILVER ,5.79,Toys,21,6
90214I,"LETTER ""I"" BLING KEY RING",0.83,Toys,10,6
90214V,"LETTER ""V"" BLING KEY RING",0.83,Stationery,21,4
22431,WATERING CAN BLUE ELEPHANT,4.13,Gifts,27,6
22432,WATERING CAN PINK BUNNY,4.13,Stationery,24,2
22471,TV DINNER TRAY AIR HOSTESS ,10.79,Home,25,2
22496,SET OF 2 ROUND TINS DUTCH CHEESE,5.79,Toys,29,3
85188B,PINK METAL SWINGING BUNNY,1.63,Home,27,5
85203,HANGING WOOD AND FELT BUTTERFLY ,0.79,Stationery,21,4
90104,PURPLE FRANGIPANI HAIRCLIP,0.82,Toys,11,5
90124B,BLUE MURANO TWIST NECKLACE,9.96,Stationery,10,5
22595,GINGHAM HEART DECORATION,1.63,Gifts,25,4
22653,BUTTON BOX ,4.13,Gifts,14,3
22760,"TRAY, BREAKFAST IN BED",24.96,Gifts,22,4
22762,CUPBOARD 3 DRAWER MA CAMPAGNE,29.17,Home,29,4
22770,MIRROR CORNICE,29.17,Gifts,24,4
22833,HALL CABINET WITH 3 DRAWERS,100.0,Toys,27,3
22869,NUMBER TILE COTTAGE GARDEN 1,4.13,Toys,13,6
22873,NUMBER TILE COTTAGE GARDEN 5,4.13,Home,25,3
84950,ASSORTED COLOUR T-LIGHT HOLDER,1.38,Gifts,29,2
35923,CANDY HEART HANGING DECORATION,2.46,Home,22,3
62094B,TURQ ICE CREAM BUM BAG ,4.96,Stationery,20,2
22935,BAKING MOULD ROSE MILK CHOCOLATE,6.63,Toys,26,5
21207,SKULL AND CROSSBONES  GARLAND ,1.63,Toys,11,2
21222,SET/4 BADGES BEETLES,2.46,Gifts,17,2
21344,MOROCCAN BEATEN METAL DISH,20.79,Toys,20,3
21413,PERIWINKLE T-LIGHT HOLDER,2.46,Toys,13,4
21446,12 RED ROSE PEG PLACE SETTINGS,2.46,Gifts,16,3
21470,FLOWER VINE RAFFIA FOOD COVER,7.46,Home,11,2
21472,LADYBIRD + BEE RAFFIA FOOD COVER,7.46,Home,13,2
21557,SET OF 6 FUNKY BEAKERS,5.79,Toys,12,5
21640,ASSORTED TUTTI FRUTTI  FOB NOTEBOOK,1.63,Stationery,25,4
84974,S/2 ZINC HEART DESIGN PLANTERS,9.95,Toys,17,6
22606,WOODEN SKITTLES GARDEN SET,12.75,Stationery,17,3
21107,CREAM SLICE FLANNEL PINK SPOT ,5.79,Gifts,19,4
21109,LARGE CAKE TOWEL CHOCOLATE SPOTS,13.29,Toys,18,5
21131,GOLD STANDING GNOME,8.29,Home,19,6
21165,BEWARE OF THE CAT METAL SIGN ,4.13,Home,28,4
22837,HOT WATER BOTTLE BABUSHKA ,9.13,Stationery,21,3
84509A,SET OF 4 ENGLISH ROSE PLACEMATS,7.46,Home,18,6
21534,DAIRY MAID LARGE MILK JUG,9.96,Stationery,25,6
21539,RED RETROSPOT BUTTER DISH,9.96,Gifts,10,5
21630,FLOOR CUSHION ELEPHANT CARNIVAL,18.29,Home,13,3
21682,LARGE MEDINA STAMPED METAL BOWL ,9.96,Stationery,25,2
21899,"KEY FOB , GARAGE DESIGN",1.63,Gifts,18,3
21901,"KEY FOB , BACK DOOR ",1.63,Home,27,2
21955,DOORMAT UNION JACK GUNS AND ROSES,14.13,Stationery,15,5
20801,LARGE PINK GLASS SUNDAE DISH,4.96,Home,19,5
20802,SMALL GLASS SUNDAE DISH CLEAR,3.29,Toys,24,4
20832,RED FLOCK LOVE HEART PHOTO FRAME,1.63,Gifts,20,3
22192,BLUE DINER WALL CLOCK,16.63,Stationery,10,6
DOT,DOTCOM POSTAGE,200.33,Gifts,25,4
22582,PACK OF 6 SWEETIE GIFT BOXES,4.96,Gifts,13,3
22602,RETROSPOT WOODEN HEART DECORATION,1.63,Stationery,12,3
22617,BAKING SET SPACEBOY DESIGN,10.79,Toys,29,5
82613C,"METAL SIGN,CUPCAKE SINGLE HOOK",2.46,Home,26,2
22684,FRENCH BLUE METAL DOOR SIGN 9,2.46,Stationery,21,2
22895,SET OF 2 TEA TOWELS APPLE AND PEARS,5.79,Gifts,26,6
22768,FAMILY PHOTO FRAME CORNICE,19.96,Toys,14,4
22910,PAPER CHAIN KIT VINTAGE CHRISTMAS,5.79,Home,26,5
35653,VINTAGE BEAD NOTEBOOK,5.79,Home,23,5
46776D,WOVEN SUNSET CUSHION COVER ,4.13,Home,13,5
72821,CUPID SCENTED CANDLE IN GLASS,1.65,Toys,15,6
22904,CALENDAR PAPER CUT DESIGN,2.55,Stationery,20,6
22246,MAGIC GARDEN FELT GARLAND ,1.95,Home,28,6
22091,EMPIRE TISSUE BOX,1.06,Home,29,6
M,Manual,4.0,Stationery,27,4
90123D,WHITE HEART OF GLASS BRACELET,5.95,Gifts,10,4
90123A,PINK HEART OF GLASS BRACELET,5.95,Home,16,6
90010E,AMBER GLASS/SILVER BRACELET,8.95,Toys,21,6
90148,LONG SILVER NECKLACE PASTEL FLOWER,12.75,Home,26,4
90016B,GOLD/M.O.P PENDANT ORBIT NECKLACE,8.5,Gifts,20,3
90016A,SILVER/M.O.P PENDANT ORBIT NECKLACE,8.5,Stationery,13,4
84847,FLORAL BATHROOM SET,3.75,Gifts,14,2
85188A,GREEN METAL SWINGING BUNNY,0.85,Stationery,14,4
20898,VINTAGE NOTEBOOK TRAVELOGUE,2.95,Gifts,16,4
85141,JARDIN ETCHED GLASS FRUITBOWL,8.95,Toys,28,4
21316,SMALL CHUNKY GLASS ROMAN  BOWL,2.95,Stationery,24,5
21320,GLASS CHALICE GREEN  LARGE ,2.55,Home,23,6
22822,CREAM WALL PLANTER HEART SHAPED,4.95,Home,17,2
22089,PAPER BUNTING VINTAGE PAISLEY,2.55,Stationery,21,4
22426,ENAMEL WASH BOWL CREAM,8.29,Toys,22,2
85026B,EAU DE NILE JEWELLED T-LIGHT HOLDER,1.63,Home,29,5
85034C,3 ROSE MORRIS BOXED CANDLES,8.29,Toys,12,5
85093,CANDY SPOT EGG WARMER HARE,2.46,Gifts,13,2
85094,CANDY SPOT EGG WARMER RABBIT,2.46,Toys,11,6
21128,GOLD FISHING GNOME,12.46,Stationery,19,2
90012A,MIDNIGHT BLUE DROP CRYSTAL NECKLACE,9.98,Home,14,4
90019B,GOLD M.O.P ORBIT BRACELET,5.4,Toys,26,4
90141A,GREEN PENDANT TRIPLE SHELL NECKLACE,5.4,Stationery,12,2
90183C,BLACK DROP EARRINGS W LONG BEADS,2.9,Toys,10,3
90185C,BLACK DIAMANTE EXPANDABLE RING,4.15,Toys,22,3
90190C,SILVER/AMETHYST DROP EARRINGS LEAF,2.9,Gifts,25,5
DCGS0069,OOH LA LA DOGS COLLAR,15.79,Gifts,11,3
DOT,DOTCOM POSTAGE,223.89,Toys,15,5
21367,MIRRORED WALL ART GENTS,4.96,Gifts,10,5
21368,MIRRORED WALL ART LADIES,4.96,Gifts,16,4
21372,MIRRORED WALL ART TABLE LAMP,5.79,Home,18,3
21382,SET/4 SPRING FLOWER DECORATION,5.79,Toys,19,2
21677,HEARTS  STICKERS,1.63,Stationery,19,5
22135,MINI LADLE LOVE HEART PINK,0.83,Stationery,18,4
22229,BUNNY WOODEN PAINTED WITH FLOWER ,1.63,Stationery,18,4
22247,BUNNY DECORATION MAGIC GARDEN,1.63,Toys,20,2
22250,DECORATION  BUTTERFLY  MAGIC GARDEN,1.63,Gifts,22,4
22270,HAPPY EASTER HANGING DECORATION,7.46,Gifts,29,5
22273,FELTCRAFT DOLL MOLLY,5.79,Home,11,2
22281,EASTER TREE YELLOW BIRDS,12.46,Gifts,23,6
22310,IVORY KNITTED MUG COSY ,3.29,Gifts,16,5
22409,MONEY BOX BISCUITS DESIGN,2.46,Home,22,4
22553,PLASTERS IN TIN SKULLS,3.29,Toys,19,4
22796,PHOTO FRAME 3 CLASSIC HANGING,20.79,Toys,25,3
47590A,BLUE HAPPY BIRTHDAY BUNTING,10.79,Home,16,6
47599B,BLUE PARTY BAGS ,4.13,Stationery,14,6
48184,DOORMAT ENGLISH ROSE ,14.13,Home,15,6
71279,PINK GLASS CANDLEHOLDER,5.79,Stationery,26,6
72800E,4 IVORY DINNER CANDLES SILVER FLOCK,3.29,Home,12,4
79030D,"TUMBLER, BAROQUE",12.46,Toys,15,5
84631,FRUIT TREE AND BIRDS WALL PLAQUE,15.79,Toys,28,3
84661B,BLACK SQUARE TABLE CLOCK,4.96,Gifts,26,4
20818,GOLD TEDDY BEAR,3.75,Stationery,27,3
85160B,BLACK BIRD GARDEN DESIGN MUG,1.25,Gifts,17,6
84465,15 PINK FLUFFY CHICKS IN BOX,2.95,Stationery,13,6
20851,ZINC HEART LATTICE TRAY OVAL ,5.95,Toys,25,2
22881,NUMBER TILE VINTAGE FONT 2,1.95,Toys,18,6
84715,SET OF 6 ICE CREAM SKITTLES,2.95,Toys,13,4
84919,BLUE CUSHION COVER WITH FLOWER,6.95,Stationery,15,2
84907,PINK YELLOW PATCH CUSHION COVER,7.65,Toys,14,6
85024B,EAU DE NILE JEWELLED PHOTOFRAME,1.65,Toys,14,4
21394,RED POLKADOT BEAKER ,4.13,Stationery,27,4
21530,DAIRY MAID TOASTRACK,5.79,Home,25,3
21654,RIDGED GLASS FINGER BOWL,3.29,Stationery,15,4
21917,SET 12 KIDS  WHITE CHALK STICKS,0.83,Home,20,3
15039,SANDALWOOD FAN,1.63,Home,26,2
17091J,VANILLA INCENSE IN TIN,2.46,Toys,16,5
20956,PORCELAIN T-LIGHT HOLDERS ASSORTED,2.46,Home,11,2
21111,"SWISS ROLL TOWEL, CHOCOLATE  SPOTS",5.79,Gifts,19,6
21200,MULTICOLOUR HONEYCOMB PAPER GARLAND,3.29,Home,12,4
21201,TROPICAL  HONEYCOMB PAPER GARLAND ,4.96,Home,23,3
21209,MULTICOLOUR HONEYCOMB FAN,3.29,Home,29,6
DCGS0003,BOXED GLASS ASHTRAY,2.46,Toys,15,3
DOT,DOTCOM POSTAGE,230.61,Gifts,24,6
22605,WOODEN CROQUET GARDEN SET,24.96,Stationery,14,6
22626,BLACK KITCHEN SCALES,16.63,Stationery,20,5
22804,CANDLEHOLDER PINK HANGING HEART,3.29,Home,18,6
22811,SET OF 6 T-LIGHTS CACTI ,5.79,Toys,13,4
22902,TOTE BAG I LOVE LONDON,4.13,Home,12,5
21250,SET OF SKULL WALL STICKERS,5.79,Stationery,27,4
22965,3 TRADITIONAl BISCUIT CUTTERS  SET,4.13,Toys,20,6
22976,CIRCUS PARADE CHILDRENS EGG CUP ,2.46,Home,10,3
35637C,PINK STRING CURTAIN WITH POLE,19.13,Stationery,28,3
40003,WHITE BAMBOO RIBS LAMPSHADE,3.29,Stationery,15,4
21265,PINK GOOSE FEATHER TREE 60CM,5.79,Home,12,5
21814,HEART T-LIGHT HOLDER ,2.92,Toys,17,5
22114,HOT WATER BOTTLE TEA AND SYMPATHY,9.13,Stationery,22,3
22119,PEACE WOODEN BLOCK LETTERS,14.13,Home,16,5
22147,FELTCRAFT BUTTERFLY HEARTS,4.13,Toys,26,3
22208,WOOD STAMP SET THANK YOU,3.29,Toys,26,2
22209,WOOD STAMP SET HAPPY BIRTHDAY,3.29,Gifts,13,4
22852,DOG BOWL VINTAGE CREAM,8.29,Gifts,11,6
DOT,DOTCOM POSTAGE,188.88,Gifts,17,5
21179,NO JUNK MAIL METAL SIGN,3.29,Toys,11,4
21811,HANGING HEART WITH BELL,2.46,Gifts,17,6
22203,MILK PAN RED RETROSPOT,7.46,Home,13,3
22621,TRADITIONAL KNITTING NANCY,2.92,Home,23,3
85174,S/4 CACTI CANDLES,10.79,Gifts,16,3
DOT,DOTCOM POSTAGE,192.21,Stationery,27,2
22559,SEASIDE FLYING DISC,1.06,Home,16,6
85014B,RED RETROSPOT UMBRELLA,4.95,Stationery,26,5
85014A,BLACK/BLUE POLKADOT UMBRELLA,4.95,Stationery,13,3
22414,DOORMAT NEIGHBOURHOOD WITCH ,6.75,Toys,17,6
84029E,RED WOOLLY HOTTIE WHITE HEART.,7.46,Stationery,18,4
84997d,PINK 3 PIECE POLKADOT CUTLERY SET,8.29,Home,11,6
20829,GLITTER HANGING BUTTERFLY STRING,4.13,Stationery,23,2
21386,IVORY HANGING DECORATION  EGG,1.63,Toys,27,2
22216,T-LIGHT HOLDER WHITE LACE,1.63,Gifts,10,3
22223,CAKE PLATE LOVEBIRD PINK,9.96,Gifts,20,2
22264,FELT FARM ANIMAL WHITE BUNNY ,1.63,Toys,26,5
22505,MEMO BOARD COTTAGE DESIGN,10.79,Toys,15,6
22932,BAKING MOULD TOFFEE CUP CHOCOLATE,4.96,Toys,10,5
22957,SET 3 PAPER VINTAGE CHICK PAPER EGG,5.79,Home,18,2
37462E,"PET MUG, GOLDFISH",0.83,Stationery,11,2
71403,"PINK/WHITE ""KEEP CLEAN"" BULLET BIN",5.79,Gifts,24,5
79160,HEART SHAPE WIRELESS DOORBELL,3.29,Stationery,27,6
85124C,GREEN JUICY FRUIT PHOTO FRAME,4.96,Stationery,25,4
DOT,DOTCOM POSTAGE,157.76,Home,22,4
71496B,A4 WALL TIDY RED FLOWERS,0.65,Toys,13,3
15036,ASSORTED COLOURS SILK FAN,0.53,Home,28,3
85146,JARDIN ETCHED GLASS SMALL BELL JAR,5.95,Gifts,27,6
35915C,PEACH KNITTED HEN ,1.65,Gifts,24,3
17028J,INCENSE BAZAAR PEACH,0.42,Stationery,22,3
17084A,TRANQUILITY MASALA INCENSE,0.21,Gifts,28,6
84795C,OCEAN STRIPE HAMMOCK ,7.95,Gifts,17,6
84660A,WHITE STITCHED WALL CLOCK,3.75,Toys,22,4
21758,VINTAGE SHELLS PRINT,6.45,Home,15,5
62074B,ELEPHANT CLIP W SUCTION CUP,0.42,Stationery,23,2
84279B,CHERRY BLOSSOM DECORATIVE FLASK,3.75,Stationery,25,2
21922,UNION STRIPE WITH FRINGE  HAMMOCK,6.95,Home,19,4
84795B,SUNSET CHECK HAMMOCK,6.95,Stationery,12,3
16016,LARGE CHINESE STYLE SCISSOR,0.72,Toys,12,5
85208,SET/12 FUNKY FELT FLOWER PEG IN BAG,1.69,Stationery,11,5
21563,RED HEART SHAPE LOVE BUCKET ,2.55,Stationery,28,2
21564,PINK  HEART SHAPE LOVE BUCKET ,2.55,Toys,21,5
22817,CARD SUKI BIRTHDAY,0.36,Stationery,13,3
22983,CARD BILLBOARD FONT,0.36,Stationery,14,3
10135,COLOURING PENCILS BROWN TUBE,2.46,Home,25,6
21001,ROSE DU SUD WASHBAG ,4.13,Stationery,24,2
21812,GARLAND WITH HEARTS AND BELLS,9.96,Home,15,3
21815,STAR  T-LIGHT HOLDER ,2.92,Home,13,2
21873,IF YOU CAN'T STAND THE HEAT MUG,3.29,Gifts,29,2
22070,SMALL RED RETROSPOT MUG IN BOX ,7.46,Stationery,13,5
84006,MAGIC TREE -PAPER FLOWERS,1.63,Gifts,12,5
84086C,PINK/PURPLE RETRO RADIO,4.13,Home,26,4
84279B,CHERRY BLOSSOM DECORATIVE FLASK,8.29,Gifts,14,3
84660B,BLACK STITCHED WALL CLOCK,7.46,Home,24,3
DOT,DOTCOM POSTAGE,86.77,Toys,27,4
22156,HEART DECORATION WITH PEARLS ,0.72,Home,29,5
85230A,OPIUM SCENTED VOTIVE CANDLE,0.29,Home,23,4
84801B,WHITE HYDRANGEA ART FLOWER,2.1,Gifts,27,3
84805A,CREAM CLIMBING HYDRANGA ART FLOWER,3.75,Home,22,5
84509C,SET OF 4 POLKADOT PLACEMATS ,2.95,Gifts,11,3
47421,ASSORTED COLOUR LIZARD SUCTION HOOK,0.36,Stationery,16,3
47422,ASSORTED MONKEY SUCTION CUP HOOK,0.36,Gifts,29,4
17136A,BLUE STONES ON WIRE FOR CANDLE,0.21,Gifts,16,5
21070,VINTAGE BILLBOARD MUG ,1.06,Stationery,22,6
22151,PLACE SETTING WHITE HEART,0.36,Gifts,26,3
85206A,CREAM FELT EASTER EGG BASKET,3.29,Toys,25,3
90205C,LARGE CRYSTAL DIAMANTE HAIRSLIDE,1.65,Toys,21,5
DOT,DOTCOM POSTAGE,189.59,Gifts,23,6
