product_id,product_name,unit_cost,category,MOQ,lead_time_days
85123A,WHITE HANGING HEART T-LIGHT HOLDER,2.55,Toys,15,6
71053,WHITE METAL LANTERN,3.39,Gifts,23,4
84406B,CREAM CUPID HEARTS COAT HANGER,2.75,Stationery,15,5
84029G,KNITTED UNION FLAG HOT WATER BOTTLE,3.39,Home,12,6
84029E,RED WOOLLY HOTTIE WHITE HEART.,3.39,Stationery,14,3
22752,SET 7 BABUSHKA NESTING BOXES,7.65,Toys,10,3
21730,GLASS STAR FROSTED T-LIGHT HOLDER,4.25,Gifts,24,5
22633,HAND WARMER UNION JACK,1.85,Gifts,28,2
22632,HAND WARMER RED POLKA DOT,1.85,Toys,26,2
84879,ASSORTED COLOUR BIRD ORNAMENT,1.69,Home,14,3
22745,POPPY'S PLAYHOUSE BEDROOM ,2.1,Stationery,20,4
22748,POPPY'S PLAYHOUSE KITCHEN,2.1,Toys,11,2
22749,FELTCRAFT PRINCESS CHARLOTTE DOLL,3.75,Stationery,25,6
22310,IVORY KNITTED MUG COSY ,1.65,Toys,17,4
84969,BOX OF 6 ASSORTED COLOUR TEASPOONS,4.25,Home,19,2
22623,BOX OF VINTAGE JIGSAW BLOCKS ,4.95,Home,15,4
22622,BOX OF VINTAGE ALPHABET BLOCKS,9.95,Gifts,26,6
21754,HOME BUILDING BLOCK WORD,5.95,Stationery,13,6
21755,LOVE BUILDING BLOCK WORD,5.95,Home,23,3
21777,RECIPE BOX WITH METAL HEART,7.95,Stationery,26,4
48187,DOORMAT NEW ENGLAND,7.95,Gifts,16,5
22960,JAM MAKING SET WITH JARS,4.25,Home,17,4
22913,RED COAT RACK PARIS FASHION,4.95,Home,20,5
22912,YELLOW COAT RACK PARIS FASHION,4.95,Gifts,10,2
22914,BLUE COAT RACK PARIS FASHION,4.95,Gifts,23,3
21756,BATH BUILDING BLOCK WORD,5.95,Gifts,21,4
22728,ALARM CLOCK BAKELIKE PINK,3.75,Stationery,26,3
22727,ALARM CLOCK BAKELIKE RED ,3.75,Stationery,21,2
22726,ALARM CLOCK BAKELIKE GREEN,3.75,Home,21,5
21724,PANDA AND BUNNIES STICKER SHEET,0.85,Gifts,22,5
21883,STARS GIFT TAPE ,0.65,Toys,16,4
10002,INFLATABLE POLITICAL GLOBE ,0.85,Toys,22,2
21791,VINTAGE HEADS AND TAILS CARD GAME ,1.25,Gifts,20,2
21035,SET/2 RED RETROSPOT TEA TOWELS ,2.95,Stationery,28,4
22326,ROUND SNACK BOXES SET OF4 WOODLAND ,2.95,Home,10,6
22629,SPACEBOY LUNCH BOX ,1.95,Toys,15,3
22659,LUNCH BOX I LOVE LONDON,1.95,Toys,27,3
22631,CIRCUS PARADE LUNCH BOX ,1.95,Home,14,3
22661,CHARLOTTE BAG DOLLY GIRL DESIGN,0.85,Home,29,2
21731,RED TOADSTOOL LED NIGHT LIGHT,1.65,Gifts,12,3
22900, SET 2 TEA TOWELS I LOVE LONDON ,2.95,Toys,13,6
21913,VINTAGE SEASIDE JIGSAW PUZZLES,3.75,Stationery,24,5
22540,MINI JIGSAW CIRCUS PARADE ,0.42,Home,28,3
22544,MINI JIGSAW SPACEBOY,0.42,Gifts,14,6
22492,MINI PAINT SET VINTAGE ,0.65,Gifts,18,3
POST,POSTAGE,18.0,Gifts,24,3
22086,PAPER CHAIN KIT 50'S CHRISTMAS ,2.55,Home,18,2
20679,EDWARDIAN PARASOL RED,4.95,Stationery,24,3
37370,RETRO COFFEE MUGS ASSORTED,1.06,Toys,22,4
21871,SAVE THE PLANET MUG,1.06,Home,18,2
21071,VINTAGE BILLBOARD DRINK ME MUG,1.06,Home,26,3
21068,VINTAGE BILLBOARD LOVE/HATE MUG,1.06,Toys,25,3
82483,WOOD 2 DRAWER CABINET WHITE FINISH,4.95,Gifts,18,4
82486,WOOD S/3 CABINET ANT WHITE FINISH,6.95,Gifts,26,4
82482,WOODEN PICTURE FRAME WHITE FINISH,2.1,Home,14,2
82494L,WOODEN FRAME ANTIQUE WHITE ,2.55,Toys,23,4
21258,VICTORIAN SEWING BOX LARGE,10.95,Toys,13,2
22114,HOT WATER BOTTLE TEA AND SYMPATHY,3.45,Home,29,2
21733,RED HANGING HEART T-LIGHT HOLDER,2.55,Home,21,4
22386,JUMBO BAG PINK POLKADOT,1.95,Gifts,18,5
85099C,JUMBO  BAG BAROQUE BLACK WHITE,1.95,Home,29,6
21033,JUMBO BAG CHARLIE AND LOLA TOYS,2.95,Stationery,11,2
20723,STRAWBERRY CHARLOTTE BAG,0.85,Stationery,13,6
84997B,RED 3 PIECE RETROSPOT CUTLERY SET,3.75,Home,21,2
84997C,BLUE 3 PIECE POLKADOT CUTLERY SET,3.75,Gifts,22,5
21094,SET/6 RED SPOTTY PAPER PLATES,0.85,Toys,15,4
20725,LUNCH BAG RED RETROSPOT,1.65,Home,27,5
21559,STRAWBERRY LUNCH BOX WITH CUTLERY,2.55,Toys,20,4
22352,LUNCH BOX WITH CUTLERY RETROSPOT ,2.55,Home,18,4
21212,PACK OF 72 RETROSPOT CAKE CASES,0.42,Gifts,23,3
21975,PACK OF 60 DINOSAUR CAKE CASES,0.55,Stationery,21,4
21977,PACK OF 60 PINK PAISLEY CAKE CASES,0.55,Stationery,21,3
84991,60 TEATIME FAIRY CAKE CASES,0.55,Toys,15,4
84519A,TOMATO CHARLIE+LOLA COASTER SET,2.95,Home,16,2
85183B,CHARLIE & LOLA WASTEPAPER BIN FLORA,1.25,Toys,16,6
85071B,RED CHARLIE+LOLA PERSONAL DOORSIGN,0.38,Home,11,2
21931,JUMBO STORAGE BAG SUKI,1.95,Home,12,6
21929,JUMBO BAG PINK VINTAGE PAISLEY,1.95,Stationery,26,4
22961,JAM MAKING SET PRINTED,1.45,Toys,26,5
22139,RETROSPOT TEA SET CERAMIC 11 PC ,4.25,Home,10,5
84854,GIRLY PINK TOOL SET,4.95,Toys,23,4
22411,JUMBO SHOPPER VINTAGE RED PAISLEY,1.95,Gifts,17,2
82567,"AIRLINE LOUNGE,METAL SIGN",2.1,Gifts,21,6
21672,WHITE SPOT RED CERAMIC DRAWER KNOB,1.25,Home,14,3
22774,RED DRAWER KNOB ACRYLIC EDWARDIAN,1.25,Toys,14,6
22771,CLEAR DRAWER KNOB ACRYLIC EDWARDIAN,1.25,Stationery,24,3
71270,PHOTO CLIP LINE,1.25,Stationery,24,3
22262,FELT EGG COSY CHICKEN,0.85,Home,23,3
22637,PIGGY BANK RETROSPOT ,2.55,Gifts,19,4
21934,SKULL SHOULDER BAG,1.65,Home,21,4
21169,YOU'RE CONFUSING ME METAL SIGN ,1.69,Stationery,22,6
21166,COOK WITH WINE METAL SIGN ,1.95,Home,13,3
21175,GIN + TONIC DIET METAL SIGN,2.1,Stationery,21,6
37444A,YELLOW BREAKFAST CUP AND SAUCER,2.95,Gifts,25,6
37444C,PINK BREAKFAST CUP AND SAUCER ,2.95,Stationery,28,3
22086,PAPER CHAIN KIT 50'S CHRISTMAS ,2.95,Toys,29,3
22083,PAPER CHAIN KIT RETROSPOT,2.95,Home,12,5
84971S,SMALL HEART FLOWERS HOOK ,0.85,Toys,21,6
47580,TEA TIME DES TEA COSY,2.55,Home,23,4
22261,FELT EGG COSY WHITE RABBIT ,0.85,Home,25,3
84832,ZINC WILLIE WINKIE  CANDLE STICK,0.85,Home,17,2
22644,CERAMIC CHERRY CAKE MONEY BANK,1.45,Toys,27,2
21533,RETROSPOT LARGE MILK JUG,4.95,Stationery,16,3
21557,SET OF 6 FUNKY BEAKERS,2.95,Home,19,4
15056BL,EDWARDIAN PARASOL BLACK,5.95,Toys,28,2
15056N,EDWARDIAN PARASOL NATURAL,5.95,Toys,13,2
22646,CERAMIC STRAWBERRY CAKE MONEY BANK,1.45,Gifts,16,5
22176,BLUE OWL SOFT TOY,2.95,Home,24,2
22438,BALLOON ART MAKE YOUR OWN FLOWERS,1.95,Home,11,6
22778,GLASS CLOCHE SMALL,3.95,Stationery,11,6
22719,GUMBALL MONOCHROME COAT RACK,1.06,Stationery,15,2
21523,DOORMAT FANCY FONT HOME SWEET HOME,6.75,Toys,20,5
21912,VINTAGE SNAKES & LADDERS,3.75,Home,29,4
21832,CHOCOLATE CALCULATOR,1.65,Stationery,12,2
22379,RECYCLING BAG RETROSPOT ,2.1,Stationery,19,6
22381,TOY TIDY PINK POLKADOT,1.85,Stationery,17,3
22798,ANTIQUE GLASS DRESSING TABLE POT,2.95,Stationery,13,6
22926,IVORY GIANT GARDEN THERMOMETER,5.95,Toys,18,5
22839,3 TIER CAKE TIN GREEN AND CREAM,14.95,Gifts,29,2
22838,3 TIER CAKE TIN RED AND CREAM,14.95,Stationery,13,2
22783,SET 3 WICKER OVAL BASKETS W LIDS,16.95,Gifts,29,3
82484,WOOD BLACK BOARD ANT WHITE FINISH,6.45,Home,26,2
84755,COLOUR GLASS T-LIGHT HOLDER HANGING,0.65,Stationery,26,4
22464,HANGING METAL HEART LANTERN,1.65,Toys,18,5
21324,HANGING MEDINA LANTERN SMALL,2.95,Stationery,24,4
22457,NATURAL SLATE HEART CHALKBOARD ,2.95,Toys,27,3
22469,HEART OF WICKER SMALL,1.45,Gifts,16,3
22470,HEART OF WICKER LARGE,2.55,Home,18,2
22224,WHITE LOVEBIRD LANTERN,2.95,Gifts,17,5
21340,CLASSIC METAL BIRDCAGE PLANT HOLDER,12.75,Home,23,5
22189,CREAM HEART CARD HOLDER,3.95,Home,13,2
22427,ENAMEL FLOWER JUG CREAM,5.95,Gifts,18,5
22428,ENAMEL FIRE BUCKET CREAM,6.95,Toys,28,3
22424,ENAMEL BREAD BIN CREAM,10.95,Gifts,11,4
22783,SET 3 WICKER OVAL BASKETS W LIDS,19.95,Toys,10,2
22663,JUMBO BAG DOLLY GIRL DESIGN,1.95,Home,27,2
85049A,TRADITIONAL CHRISTMAS RIBBONS,1.25,Gifts,26,5
22168,ORGANISER WOOD ANTIQUE WHITE ,8.5,Gifts,26,2
22662,LUNCH BAG DOLLY GIRL DESIGN,1.65,Home,27,6
84880,WHITE WIRE EGG HOLDER,4.95,Gifts,15,5
85099C,JUMBO  BAG BAROQUE BLACK WHITE,1.65,Stationery,13,6
85099B,JUMBO BAG RED RETROSPOT,1.65,Stationery,18,4
79321,CHILLI LIGHTS,3.82,Home,25,3
22780,LIGHT GARLAND BUTTERFILES PINK,3.37,Stationery,22,6
22779,WOODEN OWLS LIGHT GARLAND ,3.37,Home,23,3
22466,FAIRY TALE COTTAGE NIGHTLIGHT,1.45,Gifts,26,5
21731,RED TOADSTOOL LED NIGHT LIGHT,1.25,Home,29,6
21523,DOORMAT FANCY FONT HOME SWEET HOME,7.95,Gifts,27,5
21363,HOME SMALL WOOD LETTERS,4.95,Gifts,12,3
21411,GINGHAM HEART  DOORSTOP RED,4.25,Home,17,6
22318,FIVE HEART HANGING DECORATION,2.95,Home,25,5
22915,ASSORTED BOTTLE TOP  MAGNETS ,0.42,Stationery,18,6
22922,FRIDGE MAGNETS US DINER ASSORTED,0.85,Stationery,10,3
22969,HOMEMADE JAM SCENTED CANDLES,1.45,Stationery,20,3
22923,FRIDGE MAGNETS LES ENFANTS ASSORTED,0.85,Stationery,12,6
21115,ROSE CARAVAN DOORSTOP,6.75,Gifts,20,4
22469,HEART OF WICKER SMALL,1.65,Gifts,23,3
22242,5 HOOK HANGER MAGIC TOADSTOOL,1.65,Stationery,12,4
22941,CHRISTMAS LIGHTS 10 REINDEER,8.5,Gifts,13,6
21622,VINTAGE UNION JACK CUSHION COVER,4.95,Toys,16,5
35004C,SET OF 3 COLOURED  FLYING DUCKS,5.45,Stationery,16,6
35004G,SET OF 3 GOLD FLYING DUCKS,6.35,Gifts,14,6
85014B,RED RETROSPOT UMBRELLA,5.95,Home,16,3
85014A,BLACK/BLUE POLKADOT UMBRELLA,5.95,Home,13,4
22193,RED DINER WALL CLOCK,8.5,Home,28,5
22192,BLUE DINER WALL CLOCK,8.5,Home,22,4
22191,IVORY DINER WALL CLOCK,8.5,Toys,12,6
22195,LARGE HEART MEASURING SPOONS,1.65,Stationery,22,3
22196,SMALL HEART MEASURING SPOONS,0.85,Home,24,4
22960,JAM MAKING SET WITH JARS,3.75,Home,25,3
22962,JAM JAR WITH PINK LID,0.72,Gifts,17,4
22963,JAM JAR WITH GREEN LID,0.72,Stationery,18,5
22968,ROSE COTTAGE KEEPSAKE BOX ,8.5,Home,24,4
84970S,HANGING HEART ZINC T-LIGHT HOLDER,0.64,Toys,27,6
22910,PAPER CHAIN KIT VINTAGE CHRISTMAS,2.55,Toys,19,4
20668,DISCO BALL CHRISTMAS DECORATION,0.1,Toys,12,4
22197,SMALL POPCORN HOLDER,0.72,Gifts,12,6
22198,LARGE POPCORN HOLDER ,1.45,Gifts,26,6
21533,RETROSPOT LARGE MILK JUG,4.25,Home,22,4
21080,SET/20 RED RETROSPOT PAPER NAPKINS ,0.64,Toys,21,2
21094,SET/6 RED SPOTTY PAPER PLATES,0.64,Home,26,3
21086,SET/6 RED SPOTTY PAPER CUPS,0.65,Toys,22,5
21786,POLKADOT RAIN HAT ,0.32,Gifts,10,6
22654,DELUXE SEWING KIT ,4.95,Gifts,20,5
21485,RETROSPOT HEART HOT WATER BOTTLE,4.25,Stationery,16,6
84030E,ENGLISH ROSE HOT WATER BOTTLE,3.75,Stationery,21,6
22174,PHOTO CUBE,1.48,Home,13,4
22969,HOMEMADE JAM SCENTED CANDLES,1.25,Gifts,13,2
22150,3 STRIPEY MICE FELTCRAFT,1.95,Gifts,18,2
22619,SET OF 6 SOLDIER SKITTLES,3.75,Toys,23,5
21891,TRADITIONAL WOODEN SKIPPING ROPE,1.25,Home,25,5
21889,WOODEN BOX OF DOMINOES,1.25,Stationery,15,5
22827,RUSTIC  SEVENTEEN DRAWER SIDEBOARD,165.0,Toys,25,6
22127,PARTY CONES CARNIVAL ASSORTED,1.25,Toys,20,6
22128,PARTY CONES CANDY ASSORTED,1.25,Gifts,23,2
22502,PICNIC BASKET WICKER SMALL,5.95,Stationery,25,4
22338,STAR DECORATION PAINTED ZINC ,0.65,Stationery,12,6
22180,RETROSPOT LAMP,9.95,Toys,22,6
21506,"FANCY FONT BIRTHDAY CARD, ",0.42,Stationery,20,6
22866,HAND WARMER SCOTTY DOG DESIGN,1.85,Stationery,18,6
22865,HAND WARMER OWL DESIGN,1.85,Home,15,5
22632,HAND WARMER RED RETROSPOT,1.85,Toys,19,5
21485,RETROSPOT HEART HOT WATER BOTTLE,4.95,Toys,12,5
22349,DOG BOWL CHASING BALL DESIGN,3.75,Toys,10,4
22558,CLOTHES PEGS RETROSPOT PACK 24 ,1.25,Stationery,27,2
85152,HAND OVER THE CHOCOLATE   SIGN ,2.1,Home,25,3
22652,TRAVEL SEWING KIT,1.65,Stationery,12,3
22188,BLACK HEART CARD HOLDER,3.95,Stationery,23,5
21212,PACK OF 72 RETROSPOT CAKE CASES,0.55,Gifts,14,2
21484,CHICK GREY HOT WATER BOTTLE,3.45,Stationery,21,5
21314,SMALL GLASS HEART TRINKET POT,2.1,Toys,19,4
22730,ALARM CLOCK BAKELIKE IVORY,3.75,Home,16,5
22729,ALARM CLOCK BAKELIKE ORANGE,3.75,Gifts,18,3
22114,HOT WATER BOTTLE TEA AND SYMPATHY,3.95,Stationery,15,3
22867,HAND WARMER BIRD DESIGN,2.1,Stationery,24,3
22866,HAND WARMER SCOTTY DOG DESIGN,2.1,Toys,12,3
15056BL,EDWARDIAN PARASOL BLACK,4.95,Stationery,20,3
22803,IVORY EMBROIDERED QUILT ,35.75,Stationery,11,5
35004B,SET OF 3 BLACK FLYING DUCKS,4.65,Gifts,23,6
35004C,SET OF 3 COLOURED  FLYING DUCKS,4.65,Home,10,4
21980,PACK OF 12 RED RETROSPOT TISSUES ,0.29,Stationery,12,4
21844,RED RETROSPOT MUG,2.95,Home,14,6
22468,BABUSHKA LIGHTS STRING OF 10,6.75,Gifts,12,2
22752,SET 7 BABUSHKA NESTING BOXES,8.5,Stationery,13,3
48185,DOORMAT FAIRY CAKE,7.95,Toys,19,4
22632,HAND WARMER RED RETROSPOT,2.1,Stationery,26,5
22865,HAND WARMER OWL DESIGN,2.1,Stationery,19,3
21232,STRAWBERRY CERAMIC TRINKET BOX,1.25,Home,11,2
22064,PINK DOUGHNUT TRINKET POT ,1.65,Home,20,4
22449,SILK PURSE BABUSHKA PINK,3.35,Toys,11,2
22835,HOT WATER BOTTLE I AM SO POORLY,4.65,Home,12,4
22112,CHOCOLATE HOT WATER BOTTLE,4.95,Stationery,26,2
21479,WHITE SKULL HOT WATER BOTTLE ,3.75,Home,19,4
22111,SCOTTIE DOG HOT WATER BOTTLE,4.95,Gifts,16,3
22110,BIRD HOUSE HOT WATER BOTTLE,2.55,Gifts,12,6
22098,BOUDOIR SQUARE TISSUE BOX,1.25,Stationery,16,6
22100,SKULLS SQUARE TISSUE BOX,1.25,Toys,21,6
22766,PHOTO FRAME CORNICE,2.95,Home,15,6
22451,SILK PURSE BABUSHKA RED,3.35,Gifts,22,6
22549,PICTURE DOMINOES,1.45,Home,19,2
84744,S/6 SEW ON CROCHET FLOWERS,1.25,Gifts,14,6
85049E,SCANDINAVIAN REDS RIBBONS,1.25,Stationery,13,4
21328,BALLOONS  WRITING SET ,1.65,Toys,23,3
17091A,LAVENDER INCENSE IN TIN,1.25,Stationery,12,4
22473,TV DINNER TRAY VINTAGE PAISLEY,4.95,Home,29,5
84509A,SET OF 4 ENGLISH ROSE PLACEMATS,3.75,Stationery,11,3
84510A,SET OF 4 ENGLISH ROSE COASTERS,1.25,Gifts,29,3
22767,TRIPLE PHOTO FRAME CORNICE ,9.95,Gifts,16,2
22768,FAMILY PHOTO FRAME CORNICE,9.95,Toys,17,4
21463,MIRRORED DISCO BALL ,5.95,Stationery,16,3
21464,DISCO BALL ROTATOR BATTERY OPERATED,4.25,Stationery,26,3
20820,SILVER LOOKING MIRROR,4.95,Stationery,14,4
85150,LADIES & GENTLEMEN METAL SIGN,2.55,Stationery,11,3
22117,METAL SIGN HER DINNER IS SERVED ,2.95,Home,13,4
48129,DOORMAT TOPIARY,7.95,Stationery,13,2
82580,BATHROOM METAL SIGN,0.55,Toys,26,4
82578,KITCHEN METAL SIGN,0.55,Stationery,17,6
82581,TOILET METAL SIGN,0.55,Home,26,2
22413,METAL SIGN TAKE IT OR LEAVE IT ,2.95,Stationery,20,6
21907,I'M ON HOLIDAY METAL SIGN,2.1,Gifts,12,4
22441,GROW YOUR OWN BASIL IN ENAMEL MUG,2.1,Toys,17,6
21122,SET/10 PINK POLKADOT PARTY CANDLES,1.25,Toys,27,5
22851,SET 20 NAPKINS FAIRY CAKES DESIGN ,0.85,Stationery,12,2
22810,SET OF 6 T-LIGHTS SNOWMEN,2.95,Home,29,3
22809,SET OF 6 T-LIGHTS SANTA,2.95,Toys,15,2
22435,SET OF 9 HEART SHAPED BALLOONS,1.25,Toys,22,6
20966,SANDWICH BATH SPONGE,1.25,Home,25,6
20963,APPLE BATH SPONGE,1.25,Toys,24,3
20961,STRAWBERRY BATH SPONGE ,1.25,Stationery,26,5
22068,BLACK PIRATE TREASURE CHEST,1.65,Stationery,11,3
21743,STAR PORTABLE TABLE LIGHT ,2.95,Stationery,19,3
21744,SNOWFLAKE PORTABLE TABLE LIGHT ,2.95,Stationery,25,5
84709B,PINK OVAL JEWELLED MIRROR,5.95,Stationery,14,6
21592,RETROSPOT CIGAR BOX MATCHES ,1.25,Stationery,27,5
21587,COSY HOUR GIANT TUBE MATCHES,2.55,Gifts,16,3
20992,JAZZ HEARTS PURSE NOTEBOOK,0.85,Toys,27,4
85123A,WHITE HANGING HEART T-LIGHT HOLDER,2.95,Toys,12,2
22804,CANDLEHOLDER PINK HANGING HEART,2.95,Home,21,6
82483,WOOD 2 DRAWER CABINET WHITE FINISH,5.95,Toys,21,2
20749,ASSORTED COLOUR MINI CASES,7.95,Gifts,20,4
22382,LUNCH BAG SPACEBOY DESIGN ,1.65,Gifts,27,3
20726,LUNCH BAG WOODLAND,1.65,Gifts,16,4
22384,LUNCH BAG PINK POLKADOT,1.65,Stationery,28,6
22467,GUMBALL COAT RACK,2.55,Toys,12,6
84625C,BLUE NEW BAROQUE CANDLESTICK CANDLE,2.95,Gifts,17,2
84625A,PINK NEW BAROQUECANDLESTICK CANDLE,2.95,Home,19,4
21108,FAIRY CAKE FLANNEL ASSORTED COLOUR,2.55,Gifts,14,5
22848,BREAD BIN DINER STYLE PINK,16.95,Home,20,6
47570B,TEA TIME TABLE CLOTH,10.65,Stationery,28,4
84030E,ENGLISH ROSE HOT WATER BOTTLE,4.25,Home,19,4
22837,HOT WATER BOTTLE BABUSHKA ,4.25,Home,10,2
22867,HAND WARMER BIRD DESIGN,1.85,Toys,15,5
POST,POSTAGE,15.0,Home,21,2
22297,HEART IVORY TRELLIS SMALL,1.25,Gifts,10,4
22772,PINK DRAWER KNOB ACRYLIC EDWARDIAN,1.25,Stationery,20,2
22773,GREEN DRAWER KNOB ACRYLIC EDWARDIAN,1.25,Stationery,17,6
22805,BLUE DRAWER KNOB ACRYLIC EDWARDIAN,1.25,Toys,21,6
22197,SMALL POPCORN HOLDER,0.85,Gifts,18,3
21125,SET 6 FOOTBALL CELEBRATION CANDLES,1.25,Gifts,12,3
21126,SET OF 6 GIRLS CELEBRATION CANDLES,1.25,Stationery,24,4
85049C,ROMANTIC PINKS RIBBONS ,1.25,Home,25,4
85049D,BRIGHT BLUES RIBBONS ,1.25,Stationery,17,2
85049G,CHOCOLATE BOX RIBBONS ,1.25,Toys,12,5
21061,PARTY INVITES FOOTBALL,0.85,Home,10,4
21063,PARTY INVITES JAZZ HEARTS,0.85,Home,28,5
21062,PARTY INVITES SPACEMAN,0.85,Stationery,25,4
84380,SET OF 3 BUTTERFLY COOKIE CUTTERS,1.25,Gifts,11,5
84378,SET OF 3 HEART COOKIE CUTTERS,1.25,Gifts,10,5
22964,3 PIECE SPACEBOY COOKIE CUTTER SET,2.1,Toys,26,2
21213,PACK OF 72 SKULL CAKE CASES,0.55,Home,15,5
22417,PACK OF 60 SPACEBOY CAKE CASES,0.55,Toys,27,4
84992,72 SWEETHEART FAIRY CAKE CASES,0.55,Stationery,21,4
22383,LUNCH BAG SUKI  DESIGN ,1.65,Stationery,11,4
20728,LUNCH BAG CARS BLUE,1.65,Toys,13,2
20727,LUNCH BAG  BLACK SKULL.,1.65,Toys,13,2
22296,HEART IVORY TRELLIS LARGE,1.65,Gifts,21,2
20914,SET/5 RED RETROSPOT LID GLASS BOWLS,2.55,Home,21,3
22537,MAGIC DRAWING SLATE DINOSAUR,0.42,Gifts,27,5
22533,MAGIC DRAWING SLATE BAKE A CAKE ,0.42,Stationery,17,6
20982,12 PENCILS TALL TUBE SKULLS,0.85,Gifts,11,5
21915,RED  HARMONICA IN BOX ,1.25,Home,15,4
21914,BLUE HARMONICA IN BOX ,1.25,Stationery,17,4
21544,SKULLS  WATER TRANSFER TATTOOS ,0.85,Stationery,25,4
22813,PACK 3 BOXES BIRD PANNETONE ,1.95,Toys,15,4
84029E,RED WOOLLY HOTTIE WHITE HEART.,3.75,Gifts,24,3
84375,SET OF 20 KIDS COOKIE CUTTERS,2.1,Home,10,3
22418,10 COLOUR SPACEBOY PEN,0.85,Home,13,5
22178,VICTORIAN GLASS HANGING T-LIGHT,1.25,Home,10,6
84970L,SINGLE HEART ZINC T-LIGHT HOLDER,0.95,Home,16,5
21733,RED HANGING HEART T-LIGHT HOLDER,2.95,Home,13,3
22465,HANGING METAL STAR LANTERN,1.65,Stationery,16,4
84949,SILVER HANGING T-LIGHT HOLDER,1.65,Toys,17,2
20685,DOORMAT RED RETROSPOT,7.95,Toys,19,6
48194,DOORMAT HEARTS,7.95,Home,11,6
22488,NATURAL SLATE RECTANGLE CHALKBOARD,1.65,Gifts,15,6
22219,LOVEBIRD HANGING DECORATION WHITE ,0.85,Stationery,10,2
22610,PENS ASSORTED FUNNY FACE,0.85,Toys,19,5
22716,CARD CIRCUS PARADE,0.42,Gifts,23,4
22706,WRAP COWBOYS  ,0.42,Toys,19,6
22371,AIRLINE BAG VINTAGE TOKYO 78,4.25,Gifts,16,4
21210,SET OF 72 RETROSPOT PAPER  DOILIES,1.45,Toys,15,3
22553,PLASTERS IN TIN SKULLS,1.65,Home,28,3
16237,SLEEPING CAT ERASERS,0.21,Home,24,2
22714,CARD BIRTHDAY COWBOY,0.42,Stationery,16,6
22812,PACK 3 BOXES CHRISTMAS PANNETONE,1.95,Home,19,3
84347,ROTATING SILVER ANGELS T-LIGHT HLDR,2.55,Home,14,3
22736,RIBBON REEL MAKING SNOWMEN ,1.65,Stationery,25,5
22620,4 TRADITIONAL SPINNING TOPS,1.25,Home,18,5
21705,BAG 500g SWIRLY MARBLES,1.65,Toys,16,6
90199C,5 STRAND GLASS NECKLACE CRYSTAL,6.35,Gifts,15,3
22785,SQUARECUSHION COVER PINK UNION FLAG,6.75,Toys,18,6
22975,SPACEBOY CHILDRENS EGG CUP,1.25,Stationery,29,3
22972,CHILDREN'S SPACEBOY MUG,1.65,Home,15,4
22568,FELTCRAFT CUSHION OWL,3.75,Toys,24,5
85116,BLACK CANDELABRA T-LIGHT HOLDER,2.1,Gifts,27,2
22664,TOY TIDY DOLLY GIRL DESIGN,2.1,Gifts,14,3
21609,SET 12 LAVENDER  BOTANICAL T-LIGHTS,2.95,Gifts,18,6
21866,UNION JACK FLAG LUGGAGE TAG,1.25,Gifts,28,3
20669,RED HEART LUGGAGE TAG,1.25,Toys,15,3
90129F,RED GLASS TASSLE BAG CHARM,2.95,Toys,14,2
90210B,CLEAR ACRYLIC FACETED BANGLE,2.95,Stationery,20,6
21955,DOORMAT UNION JACK GUNS AND ROSES,7.95,Stationery,29,6
72802C,VANILLA SCENT CANDLE JEWELLED BOX,4.25,Home,17,5
22109,FULL ENGLISH BREAKFAST PLATE,3.75,Home,27,4
22531,MAGIC DRAWING SLATE CIRCUS PARADE  ,0.42,Home,18,6
21811,CHRISTMAS HANGING HEART WITH BELL,1.25,Stationery,29,3
22183,CAKE STAND VICTORIAN FILIGREE MED,6.75,Stationery,11,3
21678,PAISLEY PATTERN  STICKERS,0.85,Gifts,13,2
21676,FLOWERS  STICKERS,0.85,Home,23,3
85169B,BLACK LOVE BIRD CANDLE,1.25,Toys,18,3
16238,PARTY TIME PENCIL ERASERS,0.21,Stationery,14,3
20668,DISCO BALL CHRISTMAS DECORATION,0.12,Toys,12,5
84906,PINK B'FLY C/COVER W BOBBLES,5.95,Stationery,15,5
21867,PINK UNION JACK  LUGGAGE TAG,1.25,Gifts,16,6
22075,6 RIBBONS ELEGANT CHRISTMAS ,1.65,Toys,15,2
21326,AGED GLASS SILVER T-LIGHT HOLDER,0.65,Home,24,6
21065,BOOM BOX SPEAKER GIRLS,5.95,Gifts,17,5
22074,6 RIBBONS SHIMMERING PINKS ,1.65,Stationery,28,3
20713,JUMBO BAG OWLS,1.95,Stationery,11,5
21116,OWL DOORSTOP,4.95,Stationery,28,2
22633,HAND WARMER UNION JACK,2.1,Gifts,29,3
22198,LARGE POPCORN HOLDER ,1.65,Toys,18,5
21824,PAINTED METAL STAR WITH HOLLY BELLS,1.45,Home,19,4
21823,PAINTED METAL HEART WITH HOLLY BELL,1.45,Toys,12,4
22153,ANGEL DECORATION STARS ON DRESS,0.42,Home,15,4
85099B,JUMBO BAG RED RETROSPOT,1.95,Stationery,16,2
85099F,JUMBO BAG STRAWBERRY,1.95,Toys,21,6
20717,STRAWBERRY SHOPPER BAG,1.25,Gifts,27,5
22328,ROUND SNACK BOXES SET OF 4 FRUITS ,2.95,Home,23,2
22327,ROUND SNACK BOXES SET OF 4 SKULLS,2.95,Home,20,5
22630,DOLLY GIRL LUNCH BOX,1.95,Toys,19,6
21245,GREEN POLKADOT PLATE ,1.69,Gifts,27,3
21244,BLUE POLKADOT PLATE ,1.69,Toys,29,4
21242,RED RETROSPOT PLATE ,1.69,Home,18,4
21243,PINK  POLKADOT PLATE ,1.69,Stationery,11,4
22273,FELTCRAFT DOLL MOLLY,2.95,Gifts,11,6
22940,FELTCRAFT CHRISTMAS FAIRY,4.25,Toys,20,2
22759,SET OF 3 NOTEBOOKS IN PARCEL,1.65,Stationery,23,3
21880,RED RETROSPOT TAPE,0.65,Toys,18,6
21738,COSY SLIPPER SHOES SMALL  RED ,2.95,Stationery,14,6
22077,6 RIBBONS RUSTIC CHARM,1.65,Toys,10,5
21448,12 DAISY PEGS IN WOOD BOX,1.65,Toys,20,2
22837,HOT WATER BOTTLE BABUSHKA ,4.65,Stationery,11,6
22243,5 HOOK HANGER RED MAGIC TOADSTOOL,1.65,Gifts,14,4
22141,CHRISTMAS CRAFT TREE TOP ANGEL,2.1,Gifts,25,6
22144,CHRISTMAS CRAFT LITTLE FRIENDS,2.1,Gifts,12,6
21739,COSY SLIPPER SHOES SMALL GREEN,2.95,Home,21,3
22271,FELTCRAFT DOLL ROSIE,2.95,Gifts,22,4
22274,FELTCRAFT DOLL EMILY,2.95,Gifts,17,4
22751,FELTCRAFT PRINCESS OLIVIA DOLL,3.75,Home,10,6
21034,REX CASH+CARRY JUMBO SHOPPER,0.95,Toys,17,4
22570,FELTCRAFT CUSHION RABBIT,3.75,Toys,27,4
22569,FELTCRAFT CUSHION BUTTERFLY,3.75,Stationery,13,3
22968,ROSE COTTAGE KEEPSAKE BOX ,9.95,Home,20,2
22902,TOTE BAG I LOVE LONDON,2.1,Home,20,6
21710,FOLDING UMBRELLA PINKWHITE POLKADOT,4.95,Stationery,18,5
21708,FOLDING UMBRELLA CREAM POLKADOT,4.95,Home,15,3
21711,FOLDING UMBRELLA WHITE/RED POLKADOT,4.95,Gifts,11,2
22179,SET 10 LIGHTS NIGHT OWL,6.75,Stationery,29,5
21706,FOLDING UMBRELLA RED/WHITE POLKADOT,4.95,Gifts,10,6
85184C,S/4 VALENTINE DECOUPAGE HEART BOX,2.95,Toys,26,5
22988,SOLDIERS EGG CUP ,1.25,Toys,22,2
20750,RED RETROSPOT MINI CASES,7.95,Gifts,14,6
22952,60 CAKE CASES VINTAGE CHRISTMAS,0.55,Gifts,22,5
22910,PAPER CHAIN KIT VINTAGE CHRISTMAS,2.95,Home,21,3
22739,RIBBON REEL CHRISTMAS SOCK BAUBLE,1.65,Toys,25,3
22738,RIBBON REEL SNOWY VILLAGE,1.65,Gifts,21,5
22909,SET OF 20 VINTAGE CHRISTMAS NAPKINS,0.85,Home,29,5
35591T,TURQUOISE CHRISTMAS TREE ,1.25,Toys,21,6
22186,RED STAR CARD HOLDER,2.95,Home,10,2
22695,WICKER WREATH SMALL,1.45,Gifts,28,4
22470,HEART OF WICKER LARGE,2.95,Toys,26,3
22580,ADVENT CALENDAR GINGHAM SACK,5.95,Toys,24,3
22147,FELTCRAFT BUTTERFLY HEARTS,1.45,Stationery,15,4
22130,PARTY CONE CHRISTMAS DECORATION ,0.85,Stationery,27,4
22694,WICKER STAR ,2.1,Home,22,2
21790,VINTAGE SNAP CARDS,0.85,Gifts,28,2
22149,FELTCRAFT 6 FLOWER FRIENDS,2.1,Home,20,2
22321,BIRD DECORATION RED RETROSPOT,0.85,Home,11,4
22594,CHRISTMAS GINGHAM TREE,0.85,Gifts,22,2
22593,CHRISTMAS GINGHAM STAR,0.85,Home,19,2
22595,CHRISTMAS GINGHAM HEART,0.85,Gifts,16,6
21986,PACK OF 12 PINK POLKADOT TISSUES,0.29,Gifts,21,4
22750,FELTCRAFT PRINCESS LOLA DOLL,3.75,Gifts,26,3
22616,PACK OF 12 LONDON TISSUES ,0.29,Toys,25,2
22775,PURPLE DRAWERKNOB ACRYLIC EDWARDIAN,1.25,Toys,11,4
22899,CHILDREN'S APRON DOLLY GIRL ,2.1,Toys,20,6
22367,CHILDRENS APRON SPACEBOY DESIGN,1.95,Toys,29,4
22942,CHRISTMAS LIGHTS 10 SANTAS ,8.5,Toys,16,2
21976,PACK OF 60 MUSHROOM CAKE CASES,0.55,Toys,27,5
22951,60 CAKE CASES DOLLY GIRL DESIGN,0.55,Gifts,25,4
22834,HAND WARMER BABUSHKA DESIGN,2.1,Home,25,2
21916,SET 12 RETRO WHITE CHALK STICKS,0.42,Toys,12,2
22587,FELTCRAFT HAIRBAND RED AND BLUE,0.85,Home,22,6
22566,FELTCRAFT HAIRBAND PINK AND PURPLE,0.85,Gifts,27,6
22565,FELTCRAFT HAIRBANDS PINK AND WHITE ,0.85,Gifts,27,4
22472,TV DINNER TRAY DOLLY GIRL,4.95,Stationery,15,4
22557,PLASTERS IN TIN VINTAGE PAISLEY ,1.65,Gifts,12,5
22551,PLASTERS IN TIN SPACEBOY,1.65,Home,10,2
22554,PLASTERS IN TIN WOODLAND ANIMALS,1.65,Gifts,20,4
22534,MAGIC DRAWING SLATE SPACEBOY ,0.42,Toys,21,4
22529,MAGIC DRAWING SLATE GO TO THE FAIR ,0.42,Home,21,5
22530,MAGIC DRAWING SLATE DOLLY GIRL ,0.42,Home,16,2
84032B,CHARLIE + LOLA RED HOT WATER BOTTLE,2.95,Home,22,3
85049H,URBAN BLACK RIBBONS ,1.25,Home,19,4
22807,SET OF 6 T-LIGHTS TOADSTOOLS,2.95,Stationery,21,2
21494,ROTATING LEAVES T-LIGHT HOLDER,1.25,Stationery,24,5
22938,CUPCAKE LACE PAPER SET 6,1.95,Toys,28,2
82494L,WOODEN FRAME ANTIQUE WHITE ,2.95,Stationery,27,4
21892,TRADITIONAL WOODEN CATCH CUP GAME ,1.25,Toys,17,2
21890,S/6 WOODEN SKITTLES IN COTTON BAG,2.95,Toys,29,4
21718,RED METAL BEACH SPADE ,1.25,Home,17,4
21716,BOYS VINTAGE TIN SEASIDE BUCKET,2.55,Toys,28,5
21715,GIRLS VINTAGE TIN SEASIDE BUCKET,2.55,Home,17,2
22113,GREY HEART HOT WATER BOTTLE,3.75,Gifts,26,4
22358,KINGS CHOICE TEA CADDY ,2.95,Stationery,22,6
22357,KINGS CHOICE BISCUIT TIN,4.25,Gifts,17,2
22115,METAL SIGN EMPIRE TEA,2.95,Toys,20,3
21481,FAWN BLUE HOT WATER BOTTLE,2.95,Home,29,2
22585,PACK OF 6 BIRDY GIFT TAGS,1.25,Gifts,11,5
79321,CHILLI LIGHTS,4.95,Home,25,2
21556,CERAMIC STRAWBERRY MONEY BOX,2.55,Home,23,3
22645,CERAMIC HEART FAIRY CAKE MONEY BANK,1.45,Home,19,3
22650,CERAMIC PIRATE CHEST MONEY BANK,1.45,Home,25,2
22508,DOORSTOP RETROSPOT HEART,3.75,Stationery,17,6
22511,RETROSPOT BABUSHKA DOORSTOP,3.75,Home,11,6
22829,SWEETHEART WIRE WALL TIDY,9.95,Toys,21,5
21154,RED RETROSPOT OVEN GLOVE ,1.06,Gifts,10,6
22189,CREAM HEART CARD HOLDER,3.39,Toys,11,5
17021,NAMASTE SWAGAT INCENSE,0.24,Stationery,12,5
22059,CERAMIC STRAWBERRY DESIGN MUG,1.25,Toys,12,3
22188,BLACK HEART CARD HOLDER,3.39,Home,11,4
84678,CLASSICAL ROSE SMALL VASE,1.25,Stationery,29,6
85172,HYACINTH BULB T-LIGHT CANDLES,0.42,Stationery,21,2
22142,CHRISTMAS CRAFT WHITE FAIRY ,1.45,Stationery,11,6
21591,COSY HOUR CIGAR BOX MATCHES ,1.25,Home,21,5
22480,RED TEA TOWEL CLASSIC DESIGN,1.25,Toys,28,4
22294,HEART FILIGREE DOVE  SMALL,1.25,Home,28,2
21156,RETROSPOT CHILDRENS APRON,1.95,Stationery,19,5
10133,COLOURING PENCILS BROWN TUBE,0.85,Home,20,2
72800E,4 IVORY DINNER CANDLES SILVER FLOCK,2.55,Toys,10,4
84836,ZINC METAL HEART DECORATION,1.25,Home,20,6
20774,GREEN FERN NOTEBOOK,1.65,Toys,13,6
20773,BLUE PAISLEY NOTEBOOK,1.65,Gifts,25,2
20777,CHRYSANTHEMUM NOTEBOOK,1.65,Gifts,22,6
16016,LARGE CHINESE STYLE SCISSOR,0.85,Home,16,2
16014,SMALL CHINESE STYLE SCISSOR,0.42,Toys,15,4
21651,HANGING GLASS ETCHED TEALIGHT,1.65,Gifts,24,6
22618,COOKING SET RETROSPOT,9.95,Home,28,2
21586,KINGS CHOICE GIANT TUBE MATCHES,2.55,Toys,20,5
22152,PLACE SETTING WHITE STAR,0.42,Toys,12,2
84754,S/15 SILVER GLASS BAUBLES IN BAG,1.25,Home,12,3
22670,FRENCH WC SIGN BLUE METAL,1.25,Home,19,5
