product_id,product_name,unit_cost,category,MOQ,lead_time_days
90212C,PURPLE LAS VEGAS BRACELET ROUND,3.75,Stationery,27,5
22207,FRYING PAN UNION FLAG,4.25,Toys,28,5
22708,WRAP DOLLY GIRL,0.42,Toys,26,5
22048,BIRTHDAY BANQUET GIFT WRAP,0.42,Gifts,28,2
22057,CERAMIC PLATE STRAWBERRY DESIGN,1.49,Stationery,24,5
37447,CERAMIC CAKE DESIGN SPOTTED PLATE,1.49,Home,17,2
22930,BAKING MOULD HEART MILK CHOCOLATE,2.55,Home,15,6
22931,BAKING MOULD HEART WHITE CHOCOLATE,2.55,Gifts,14,4
22932,BAKING MOULD TOFFEE CUP CHOCOLATE,2.55,Stationery,21,2
22937,BAKING MOULD CHOCOLATE CUPCAKES,2.55,Toys,24,3
22710,WRAP I LOVE LONDON ,0.42,Toys,11,3
22051,BLUE SCANDINAVIAN PAISLEY WRAP,0.42,Home,29,4
22936,BAKING MOULD ROSE WHITE CHOCOLATE,3.25,Stationery,26,2
22935,BAKING MOULD ROSE MILK CHOCOLATE,3.25,Stationery,13,4
21463,MIRRORED DISCO BALL ,4.95,Home,21,2
22789,T-LIGHT HOLDER SWEETHEART HANGING,1.95,Gifts,21,5
21313,GLASS HEART T-LIGHT HOLDER ,0.64,Gifts,14,2
21735,TWO DOOR CURIO CABINET,10.95,Gifts,21,2
20716,PARTY FOOD SHOPPER BAG,1.25,Home,23,4
22167, OVAL WALL MIRROR DIAMANTE ,9.95,Stationery,21,2
47348A,FUSCHIA VOILE POINTY SHOE DEC,1.95,Home,29,4
90214C,"LETTER ""C"" BLING KEY RING",1.25,Gifts,14,3
90214B,"LETTER ""B"" BLING KEY RING",1.25,Toys,12,4
90214K,"LETTER ""K"" BLING KEY RING",1.25,Gifts,26,4
85039C,S/4 BLACK MINI ROSE CANDLE IN BOWL,1.65,Stationery,18,2
20996,JAZZ HEARTS ADDRESS BOOK,0.42,Gifts,16,6
21686,MEDINA STAMPED METAL STOOL,39.95,Stationery,14,3
22932,BAKING MOULD TOFFEE CUP CHOCOLATE,2.1,Toys,10,6
22935,BAKING MOULD ROSE MILK CHOCOLATE,2.75,Gifts,28,3
22931,BAKING MOULD HEART WHITE CHOCOLATE,2.1,Home,26,2
22930,BAKING MOULD HEART MILK CHOCOLATE,2.1,Stationery,14,3
85024C,PINK SMALL JEWELLED PHOTOFRAME,1.65,Toys,11,5
71038,WHITE HANGING BEADS CANDLE HOLDER,5.45,Home,18,2
48173C,DOORMAT BLACK FLOCK ,6.75,Toys,15,2
22688,DOORMAT PEACE ON EARTH BLUE,6.75,Gifts,28,3
84613C,BLUE NEW BAROQUE FLOCK CANDLESTICK,4.65,Home,22,4
84828,JUNGLE POPSICLES ICE LOLLY HOLDERS,1.25,Stationery,25,4
84910A,PINK PAISLEY CUSHION COVER ,5.95,Gifts,11,5
20763,DAISY SKETCHBOOK ,3.75,Toys,27,6
22144,CHRISTMAS CRAFT LITTLE FRIENDS,1.85,Gifts,17,3
21201,TROPICAL  HONEYCOMB PAPER GARLAND ,2.55,Home,18,5
21246,RED RETROSPOT BIG BOWL,4.95,Toys,16,6
21376,LARGE  TALL CAMPHOR WOOD TOADSTOOL ,5.45,Toys,29,4
21375,LARGE CAMPHOR WOOD FIELD MUSHROOM ,5.45,Gifts,19,5
21205,MULTICOLOUR 3D BALLS GARLAND,2.55,Home,10,5
20618,QUEEN OF THE SKIES PASSPORT COVER ,2.1,Toys,16,6
21896,POTTING SHED TWINE,2.1,Toys,11,3
22509,SEWING BOX RETROSPOT DESIGN ,14.95,Home,25,5
22265,EASTER DECORATION NATURAL CHICK,0.65,Gifts,12,3
47420,ASSORTED COLOUR SUCTION CUP HOOK,0.19,Stationery,26,4
21931,JUMBO STORAGE BAG SUKI,1.65,Toys,29,5
22386,JUMBO BAG PINK POLKADOT,1.65,Toys,25,3
20712,JUMBO BAG WOODLAND ANIMALS,1.65,Gifts,22,3
22385,JUMBO BAG SPACEBOY DESIGN,1.65,Gifts,14,4
85099F,JUMBO BAG STRAWBERRY,1.65,Stationery,11,6
20711,JUMBO BAG TOYS ,1.65,Gifts,26,6
20713,JUMBO BAG OWLS,1.65,Gifts,12,5
22510,GINGHAM BABUSHKA DOORSTOP,3.75,Toys,11,4
48116,DOORMAT MULTICOLOUR STRIPE,7.95,Toys,29,6
72709,IVORY SCULPTED RND CANDLE ,0.85,Home,24,2
72132,COLUMBIAN CUBE CANDLE,1.95,Stationery,16,4
85118,HEART T-LIGHT HOLDER,1.25,Toys,25,5
35968,FOLK ART METAL HEART T-LIGHT HOLDER,0.38,Gifts,15,6
85067,CREAM SWEETHEART WALL CABINET,16.95,Gifts,19,3
22761,CHEST 7 DRAWER MA CAMPAGNE,21.95,Toys,22,3
22762,CUPBOARD 3 DRAWER MA CAMPAGNE,12.75,Toys,19,6
22063,CERAMIC BOWL WITH STRAWBERRY DESIGN,2.95,Toys,26,2
90184B,AMETHYST CHUNKY BEAD BRACELET W STR,8.95,Gifts,11,5
90184A,AMBER CHUNKY BEAD BRACELET W STRAP,8.95,Toys,13,4
M,Manual,2.95,Home,23,6
84415B,BLUE FLOCK CUSHION COVER ,3.75,Toys,12,5
20906,VINTAGE NOTEBOOK BEAUTY GIRL,2.95,Stationery,18,3
22083,PAPER CHAIN KIT RETROSPOT,2.55,Stationery,10,6
21098,CHRISTMAS TOILET ROLL,1.06,Gifts,24,3
21275,ZINC TOP  2 DOOR WOODEN SHELF ,16.95,Toys,22,3
47566,PARTY BUNTING,3.75,Stationery,16,2
90173,PAIR BUTTERFLY HAIR CLIPS,3.75,Gifts,13,2
22513,DOORSTOP FOOTBALL DESIGN,3.75,Gifts,17,4
71496A,A4 WALL TIDY BLUE OFFICE,0.65,Home,24,2
71495B,CD WALL TIDY RED FLOWERS,0.42,Home,11,2
78124,MAGAZINE RACK GEBRA ASSORTED ,2.75,Home,26,3
37500,TEA TIME TEAPOT IN GIFT BOX,9.95,Gifts,24,3
37343,POLKADOT MUG PINK ,3.36,Home,22,6
71279,PINK GLASS CANDLEHOLDER,5.91,Home,10,5
72802B,OCEAN SCENT CANDLE IN JEWELLED BOX,8.47,Home,17,5
72802C,VANILLA SCENT CANDLE JEWELLED BOX,8.47,Gifts,23,3
79403,FROSTED WHITE BASE ,1.66,Toys,25,3
84251G,"GREETING CARD, OVERCROWDED POOL.",0.85,Stationery,22,2
84508C,BLUE CIRCLES DESIGN TEDDY,5.06,Stationery,23,5
84993A,75 GREEN PETIT FOUR CASES,0.84,Home,13,4
85124C,GREEN JUICY FRUIT PHOTO FRAME,5.06,Toys,13,6
85129B,BEADED CRYSTAL HEART GREEN SMALL,2.51,Toys,27,6
90034,WHITE SILVER NECKLACE SHELL GLASS,10.19,Home,24,3
90040C,MURANO STYLE GLASS BRACELET GOLD,3.81,Home,19,3
90059D,DIAMANTE HAIR GRIP PACK/2 PERIDOT,1.69,Stationery,15,6
90089,PINK CRYSTAL SKULL PHONE CHARM,1.66,Toys,16,5
90120A,PINK MURANO TWIST BRACELET,4.24,Stationery,19,5
90201D,GREEN ENAMEL FLOWER RING,2.96,Home,12,5
DOT,DOTCOM POSTAGE,729.42,Gifts,23,5
17013D,ORIGAMI ROSE INCENSE IN TUBE,3.36,Toys,20,5
17091J,VANILLA INCENSE IN TIN,2.51,Gifts,11,2
17096,ASSORTED LAQUERED INCENSE HOLDERS,0.43,Stationery,21,4
20766,GARDEN PATH SKETCHBOOK,7.62,Home,13,2
20775,DAISY NOTEBOOK ,3.36,Gifts,28,5
20998,ROSE DU SUD OVEN GLOVE,3.36,Gifts,19,6
21058,PARTY INVITES WOODLAND,1.66,Home,28,3
21078,SET/20 STRAWBERRY PAPER NAPKINS ,1.66,Stationery,23,2
21125,SET 6 FOOTBALL CELEBRATION CANDLES,2.51,Toys,22,3
21126,SET OF 6 GIRLS CELEBRATION CANDLES,2.51,Stationery,10,2
21285,RETROSPOT CANDLE  MEDIUM,4.21,Toys,18,5
21417,COCKLE SHELL DISH,4.21,Toys,18,3
21430,SET/3 RED GINGHAM ROSE STORAGE BOX,7.62,Home,22,3
21442,GREEN BIRDHOUSE DECORATION,1.66,Home,22,4
21657,MILK BOTTLE WITH GLASS STOPPER ,14.43,Gifts,23,2
21668,RED STRIPE CERAMIC DRAWER KNOB,2.51,Toys,27,4
21717,EASTER TIN BUCKET,5.06,Gifts,13,2
21749,LARGE RED RETROSPOT WINDMILL,4.21,Home,19,2
21750,LARGE SKULL WINDMILL,4.21,Stationery,27,4
21785,RAIN PONCHO ,1.66,Gifts,15,3
21804,WHITE CHRISTMAS GARLAND STARS TREES,7.62,Toys,23,2
21819,GLITTER CHRISTMAS STAR ,1.66,Toys,20,5
22025,RING OF ROSES BIRTHDAY CARD,0.85,Stationery,17,4
22035,VINTAGE CARAVAN GREETING CARD ,0.85,Toys,12,6
22097,SWALLOW SQUARE TISSUE BOX,2.51,Toys,19,5
22164,STRING OF STARS CARD HOLDER,5.91,Gifts,20,3
22180,RETROSPOT LAMP,21.23,Home,23,4
22264,FELT FARM ANIMAL WHITE BUNNY ,1.66,Home,22,2
22292,HANGING CHICK  YELLOW DECORATION,2.98,Gifts,24,2
22306,SILVER MUG BONE CHINA TREE OF LIFE,8.47,Stationery,26,5
22349,DOG BOWL CHASING BALL DESIGN,7.62,Toys,16,5
22385,JUMBO BAG SPACEBOY DESIGN,4.21,Stationery,25,2
22480,RED TEA TOWEL CLASSIC DESIGN,2.51,Gifts,21,4
22538,MINI JIGSAW GO TO THE FAIR,0.85,Home,24,6
22541,MINI JIGSAW LEAP FROG,0.85,Home,18,5
22559,SEASIDE FLYING DISC,2.51,Home,22,6
22641,SET OF 4 NAPKIN CHARMS INSTRUMENT,5.06,Home,20,6
22647,CERAMIC LOVE HEART MONEY BANK,3.36,Gifts,14,4
22690,DOORMAT HOME SWEET HOME BLUE ,14.43,Stationery,21,2
22701,PINK DOG BOWL,5.91,Toys,12,4
22778,GLASS CLOCHE SMALL,8.47,Stationery,16,2
22819,"BIRTHDAY CARD, RETRO SPOT",0.85,Stationery,27,6
22166,WALL MIRROR RECTANGLE DIAMANTE PINK,7.95,Stationery,20,2
22145,CHRISTMAS CRAFT HEART STOCKING ,2.1,Stationery,10,3
22163,HEART STRING MEMO HOLDER HANGING,2.95,Home,11,2
21215,IVORY PAPER CUP CAKE CASES ,0.55,Home,17,6
85048,15CM CHRISTMAS GLASS BALL 20 LIGHTS,6.95,Toys,27,2
20761,BLUE PAISLEY SKETCHBOOK,3.75,Toys,21,5
51008,AFGHAN SLIPPER SOCK PAIR,2.95,Home,23,2
85118,HEART T-LIGHT HOLDER,0.38,Toys,24,2
85230G,ORANGE VOTIVE CANDLE,0.29,Toys,27,6
16014,SMALL CHINESE STYLE SCISSOR,0.32,Home,11,5
35833P,4 PINK FLOCK CHRISTMAS BALLS,1.25,Stationery,29,6
71215,METAL BASE FOR CANDLES,0.42,Toys,27,3
20886,BOX OF 9 PEBBLE CANDLES,1.95,Gifts,12,4
20695,FLORAL BLUE MONSTER,4.25,Stationery,13,4
20892,SET/3 TALL GLASS CANDLE HOLDER PINK,12.75,Home,28,3
22324,BLUE POLKADOT KIDS BAG,1.95,Gifts,28,2
22820,GIFT BAG BIRTHDAY,0.65,Gifts,16,2
16168M,FUNKY MONKEY GIFT BAG MEDIUM,0.42,Stationery,10,2
22644,CERAMIC CHERRY CAKE MONEY BANK,1.25,Stationery,22,2
22645,CERAMIC HEART FAIRY CAKE MONEY BANK,1.25,Gifts,25,6
84952A,CLEAR LOVE BIRD T-LIGHT HOLDER,3.75,Gifts,15,3
21846,PINK DIAMANTE PEN IN GIFT BOX,4.95,Stationery,10,3
22487,WHITE WOOD GARDEN PLANT LADDER,8.5,Home,23,6
84706D,CHERRY BLOSSOM TABLE CLOCK ,8.95,Toys,20,5
22828,REGENCY MIRROR WITH SHUTTERS,165.0,Gifts,20,2
22827,RUSTIC  SEVENTEEN DRAWER SIDEBOARD,145.0,Stationery,20,4
21281,VINTAGE KITCHEN PRINT SEAFOOD,2.55,Home,24,6
22591,CARDHOLDER GINGHAM CHRISTMAS TREE,2.55,Toys,12,3
22171,3 HOOK PHOTO SHELF ANTIQUE WHITE,7.65,Gifts,25,3
21361,LOVE LARGE WOOD LETTERS ,10.95,Stationery,23,5
21755,LOVE BUILDING BLOCK WORD,5.45,Toys,24,2
22703,PINK CAT BOWL,2.1,Home,19,5
22605,WOODEN CROQUET GARDEN SET,12.75,Gifts,26,2
48188,DOORMAT WELCOME PUPPIES,6.75,Stationery,11,2
22804,CANDLEHOLDER PINK HANGING HEART,2.55,Gifts,20,3
21684,SMALL MEDINA STAMPED METAL BOWL ,0.85,Gifts,20,2
79000,MOROCCAN TEA GLASS,0.65,Gifts,12,3
84247L,FAWN AND MUSHROOM GREETING CARD,0.42,Gifts,12,6
22937,BAKING MOULD CHOCOLATE CUP CAKES,2.55,Home,20,2
85170C,SET/6 EAU DE NIL BIRD T-LIGHTS,2.1,Home,19,6
22516,CHILDS GARDEN RAKE BLUE,2.1,Stationery,21,4
22523,CHILDS GARDEN FORK PINK,0.85,Home,10,5
22521,CHILDS GARDEN TROWEL PINK,0.85,Home,27,5
22698,PINK REGENCY TEACUP AND SAUCER,2.95,Toys,12,4
85053,FRENCH ENAMEL CANDLEHOLDER,2.1,Gifts,11,5
84875B,GREEN SQUARE COMPACT MIRROR,3.75,Toys,21,2
84876D,BLUE HEART COMPACT MIRROR,3.75,Toys,15,2
90211B,JET BLACK LAS VEGAS NECKLACE 45CM,5.95,Home,27,4
84192,ASSORTED COLOUR METAL CAT ,1.25,Toys,27,5
22560,TRADITIONAL MODELLING CLAY,1.06,Home,10,3
21190,PINK HEARTS PAPER GARLAND,1.45,Gifts,13,6
21628,TRIANGULAR POUFFE VINTAGE ,14.95,Home,27,4
22779,WOODEN OWLS LIGHT GARLAND ,3.75,Toys,12,2
22951,60 CAKE CASES DOLLY GIRL DESIGN,0.42,Gifts,20,3
22956,36 FOIL HEART CAKE CASES,1.85,Home,14,5
22254,FELT TOADSTOOL LARGE,1.25,Home,15,6
22769,CHALKBOARD KITCHEN ORGANISER,21.95,Gifts,29,2
21615,4 LAVENDER BOTANICAL DINNER CANDLES,3.75,Gifts,11,6
22236,CAKE STAND 3 TIER MAGIC GARDEN,10.95,Stationery,26,5
22933,BAKING MOULD EASTER EGG MILK CHOC,2.95,Home,16,3
22689,DOORMAT MERRY CHRISTMAS RED ,7.95,Toys,27,5
85107,CUT GLASS T-LIGHT HOLDER OCTAGON,2.55,Gifts,26,5
22741,FUNKY DIVA PEN,0.85,Stationery,20,2
21051,RIBBONS PURSE ,2.1,Gifts,11,6
21382,SET/4 SPRING FLOWER DECORATION,2.95,Stationery,20,4
44234,ASSORTED CIRCULAR MOBILE,0.21,Gifts,13,4
44235,ASS COL CIRCLE MOBILE ,0.42,Gifts,28,4
75131,METAL TUBE CHIME ON BAMBOO,1.69,Stationery,27,5
40003,WHITE BAMBOO RIBS LAMPSHADE,1.25,Stationery,18,4
84360,TABLE LAMP WHITE SHADE WOOD BASE,4.65,Gifts,11,6
47480,HANGING PHOTO CLIP ROPE LADDER,1.45,Home,15,5
79190B,RETRO PLASTIC POLKA TRAY,0.42,Gifts,20,4
82001S,VINYL RECORD FRAME SILVER,3.75,Home,16,3
90036D,"FLOWER GLASS GARLAND NECKL.36""BLACK",7.95,Toys,23,4
22830,UTILTY CABINET WITH HOOKS,19.94,Gifts,10,4
22154,ANGEL DECORATION 3 BUTTONS ,0.36,Home,17,5
20707,CRAZY DAISY HEART DECORATION,2.51,Gifts,18,5
20854,BLUE PATCH PURSE PINK HEART,3.36,Stationery,20,3
20897,VINTAGE NOTEBOOK PARIS DAYS,5.91,Stationery,27,4
21094,SET/6 RED SPOTTY PAPER PLATES,1.66,Toys,26,2
21106,CREAM SLICE FLANNEL CHOCOLATE SPOT ,5.91,Toys,15,3
21120,*Boombox Ipod Classic,16.98,Home,24,6
21264,WHITE GOOSE FEATHER TREE 60CM ,5.91,Toys,29,6
21284,RETROSPOT CANDLE  SMALL,3.36,Toys,29,5
21556,CERAMIC STRAWBERRY MONEY BOX,5.06,Toys,15,4
21561,DINOSAUR LUNCH BOX WITH CUTLERY,5.06,Stationery,15,4
21670,BLUE SPOT CERAMIC DRAWER KNOB,2.51,Home,10,2
21672,WHITE SPOT RED CERAMIC DRAWER KNOB,2.51,Home,17,4
21880,RED RETROSPOT TAPE,1.66,Stationery,28,4
21902,"KEY FOB , FRONT  DOOR ",1.66,Stationery,21,5
22026,BANQUET BIRTHDAY  CARD  ,0.85,Home,13,3
22089,PAPER BUNTING VINTAGE PAISLEY,5.91,Home,13,2
22152,PLACE SETTING WHITE STAR,1.66,Gifts,25,5
22201,FRYING PAN BLUE POLKADOT,8.47,Home,28,5
22243,5 HOOK HANGER RED MAGIC TOADSTOOL,3.36,Stationery,13,6
22269,EGG CUP NATURAL CHICKEN,2.51,Toys,18,2
22315,200 RED + WHITE BENDY STRAWS,2.51,Home,28,5
22439,6 ROCKET BALLOONS ,1.28,Home,17,2
22526,WHEELBARROW FOR CHILDREN ,25.49,Gifts,10,6
22585,PACK OF 6 BIRDY GIFT TAGS,0.0,Gifts,12,6
22671,FRENCH LAUNDRY SIGN BLUE METAL,3.36,Gifts,18,2
22700,BLACK AND WHITE DOG BOWL,5.91,Gifts,10,3
22763,KEY CABINET MA CAMPAGNE,20.38,Toys,19,2
22767,TRIPLE PHOTO FRAME CORNICE ,20.38,Home,29,4
22903,CALENDAR FAMILY FAVOURITES,5.91,Stationery,20,5
22907,PACK OF 20 NAPKINS PANTRY DESIGN,1.66,Gifts,20,2
22984,CARD GINGHAM ROSE ,0.85,Gifts,17,3
35241,ENAMEL BLUE RIM BISCUIT BIN,10.17,Toys,29,3
72760B,VINTAGE CREAM 3 BASKET CAKE STAND,21.23,Stationery,25,6
79190A,RETRO PLASTIC 70'S TRAY,0.85,Toys,22,3
79190B,RETRO PLASTIC POLKA TRAY,0.85,Toys,18,4
84012,MAGIC SHEEP WOOL GROWING FROM PAPER,5.06,Home,12,4
84247G,"DECOUPAGE,GREETING CARD,",0.85,Gifts,11,3
84674,FLYING PIG WATERING CAN,5.91,Toys,13,2
84678,CLASSICAL ROSE SMALL VASE,5.06,Home,29,2
84707B,PINK JEWELLED MIRROR TRINKET TRAY,8.47,Stationery,19,6
84877D,BLUE ROUND COMPACT MIRROR,3.36,Gifts,25,2
84952A,CLEAR LOVE BIRD T-LIGHT HOLDER,7.62,Toys,16,2
84952C,MIRROR LOVE BIRD T-LIGHT HOLDER,7.62,Home,21,4
85035B,CHOCOLATE 3 WICK MORRIS BOX CANDLE,8.47,Home,18,3
85180B,PINK HEARTS LIGHT CHAIN ,9.32,Toys,18,2
90010B,BLACK/WHITE GLASS/SILVER BRACELET,9.77,Stationery,29,3
90030B,RED KUKUI COCONUT SEED NECKLACE,5.94,Toys,13,6
90030C,BROWN KUKUI COCONUT SEED NECKLACE,5.94,Toys,18,5
90039B,FIRE POLISHED GLASS BRACELET MONTAN,3.81,Home,23,2
90039D,FIRE POLISHED GLASS BRACELET GREEN,3.81,Home,25,2
90093,CLEAR CRYSTAL STAR PHONE CHARM,1.66,Stationery,19,5
90128A,PINK LEAVES AND BEADS PHONE CHARM,2.51,Home,10,4
90128B,BLUE LEAVES AND BEADS PHONE CHARM,2.51,Home,24,2
90128C,GREEN LEAVES AND BEADS PHONE CHARM,2.51,Home,27,6
90128D,PURPLE LEAVES AND BEADS PHONE CHAR,2.51,Home,17,3
90161C,ANT COPPER LIME BOUDICCA BRACELET,5.09,Home,24,2
90174,BUTTERFLY HAIR BAND,2.54,Toys,27,4
90188,DROP EARRINGS W FLOWER & LEAF,2.54,Gifts,17,3
90210B,CLEAR ACRYLIC FACETED BANGLE,2.96,Home,13,5
90214O,"LETTER ""O"" BLING KEY RING",0.85,Gifts,28,6
DCGS0076,SUNJAR LED NIGHT NIGHT LIGHT,16.13,Gifts,22,3
DOT,DOTCOM POSTAGE,885.94,Home,16,4
16015,MEDIUM CHINESE STYLE SCISSOR,0.5,Toys,29,5
16008,SMALL FOLDING SCISSOR(POINTED EDGE),0.25,Home,11,5
37444B,BLUE BREAKFAST CUP AND SAUCER ,2.95,Toys,12,3
37333,"RETRO ""TEA FOR ONE"" ",4.95,Home,21,4
20778,GARDEN PATH NOTEBOOK ,1.65,Gifts,22,5
20758,ABSTRACT CIRCLES POCKET BOOK,0.85,Stationery,22,6
85039B,S/4 IVORY MINI ROSE CANDLE IN BOWL,1.65,Gifts,28,6
85040B,SET/4 BLUE FLOWER CANDLES IN BOWL,1.65,Gifts,22,2
21535,RED RETROSPOT SMALL MILK JUG,2.55,Gifts,14,5
22319,HAIRCLIPS FORTIES FABRIC ASSORTED,0.65,Home,28,3
21284,RETROSPOT CANDLE  SMALL,1.69,Toys,29,5
22824,3 TIER SWEETHEART GARDEN SHELF,35.95,Stationery,29,6
17084N,FAIRY DREAMS INCENSE ,0.21,Toys,16,6
17084P,DRAGONS BLOOD INCENSE,0.21,Gifts,13,4
21128,GOLD FISHING GNOME,6.95,Home,10,3
21132,SILVER STANDING GNOME   ,4.25,Gifts,21,6
84818,DANISH ROSE PHOTO FRAME,2.55,Gifts,29,5
21879,HEARTS GIFT TAPE,0.65,Gifts,19,4
35001W,HAND OPEN SHAPE DECO.WHITE,2.95,Stationery,10,5
90192,JADE DROP EARRINGS W FILIGREE,4.95,Stationery,23,3
90033,IVORY SHELL HEART EARRINGS,2.55,Toys,29,2
85008,SET OF 3 CONEY ISLAND OVAL BOXES,4.95,Toys,17,6
84913B,MINT GREEN ROSE TOWEL,4.65,Stationery,12,6
84913A,SOFT PINK ROSE TOWEL ,4.65,Stationery,15,6
84915,HAND TOWEL PINK FLOWER AND DAISY,5.95,Gifts,23,2
84843,WHITE SOAP RACK WITH 2 BOTTLES,5.95,Stationery,26,2
22236,CAKE STAND 3 TIER MAGIC GARDEN,12.75,Stationery,10,3
85032A,ROMANTIC IMAGES GIFT WRAP SET,2.1,Toys,13,6
85032C,CURIOUS IMAGES GIFT WRAP SET,2.1,Home,28,4
35648,VINTAGE BEAD PINK PURSE ,2.95,Gifts,18,2
M,Manual,15.0,Home,17,3
21985,PACK OF 12 HEARTS DESIGN TISSUES ,0.81,Gifts,18,6
22414,DOORMAT NEIGHBOURHOOD WITCH ,14.43,Gifts,11,5
22663,JUMBO BAG DOLLY GIRL DESIGN,5.06,Gifts,12,5
35809a,ENAMEL PINK TEA CONTAINER,4.21,Gifts,11,3
48116,DOORMAT MULTICOLOUR STRIPE,14.43,Stationery,10,2
72817,SET OF 2 CHRISTMAS DECOUPAGE CANDLE,4.21,Toys,27,6
79066k,RETRO MOD TRAY,1.66,Gifts,17,3
84536b,FAIRY CAKES NOTEBOOK A7 SIZE,0.81,Home,25,2
84968a,SET OF 16 VINTAGE ROSE CUTLERY,25.49,Toys,15,5
DOT,DOTCOM POSTAGE,547.32,Home,16,3
20998,ROSE DU SUD OVEN GLOVE,5.91,Toys,22,5
21018,BIRD BOX CHRISTMAS TREE DECORATION,2.51,Stationery,21,4
21144,PINK POODLE HANGING DECORATION ,3.36,Gifts,13,4
21179,NO JUNK MAIL METAL SIGN,3.36,Home,19,6
21317,GLASS SPHERE CANDLE STAND MEDIUM,11.02,Home,21,2
21836,GINGHAM OVEN GLOVE RED HEART ,7.62,Gifts,11,4
22120,WELCOME  WOODEN BLOCK LETTERS,20.38,Toys,12,2
72815,3 WICK CHRISTMAS BRIAR CANDLE ,8.47,Toys,24,3
84510a,SET OF 4 ENGLISH ROSE COASTERS,2.51,Gifts,15,4
84968e,SET OF 16 VINTAGE BLACK CUTLERY,25.49,Home,18,6
85035a,GARDENIA 3 WICK MORRIS BOXED CANDLE,8.47,Home,18,4
DOT,DOTCOM POSTAGE,620.68,Gifts,20,2
21807,WHITE CHRISTMAS STAR DECORATION,0.85,Toys,25,2
21895,POTTING SHED SOW 'N' GROW SET,8.47,Toys,24,3
22885,NUMBER TILE VINTAGE FONT 6 ,4.21,Home,26,2
84660b,BLACK STITCHED WALL CLOCK,7.62,Stationery,22,3
DOT,DOTCOM POSTAGE,822.94,Home,24,4
22838,3 TIER CAKE TIN RED AND CREAM,29.95,Toys,20,4
DOT,DOTCOM POSTAGE,85.79,Stationery,14,3
84356,POMPOM CURTAIN,6.95,Home,17,5
22734,SET OF 6 RIBBONS VINTAGE CHRISTMAS,2.55,Home,17,2
47578A,ENGLISH ROSE SMALL SCENTED FLOWER,0.85,Stationery,15,5
22679,FRENCH BLUE METAL DOOR SIGN 4,1.25,Stationery,16,5
22416,SET OF 36 DOILIES SPACEBOY DESIGN ,1.45,Stationery,28,3
21562,HAWAIIAN GRASS SKIRT ,1.25,Gifts,18,6
84228,HEN HOUSE W CHICK STANDING,0.42,Stationery,25,2
22419,LIPSTICK PEN RED,0.36,Gifts,11,5
22856,ASSORTED EASTER DECORATIONS  BELLS,1.25,Home,23,5
22934,BAKING MOULD EASTER EGG WHITE CHOC,2.95,Home,19,2
21181,PLEASE ONE PERSON METAL SIGN,1.85,Stationery,22,5
16048,TEATIME ROUND PENCIL SHARPENER ,0.85,Toys,18,2
20618,QUEEN OF THE SKIES PASSPORT COVER ,4.21,Toys,21,4
20764,ABSTRACT CIRCLES SKETCHBOOK ,7.62,Toys,26,2
20932,PINK POT PLANT CANDLE,7.62,Stationery,15,6
21467,CHERRY CROCHET FOOD COVER,7.62,Stationery,21,3
21518,BANK ACCOUNT  GREETING  CARD ,0.85,Stationery,21,6
21624,VINTAGE UNION JACK DOORSTOP,11.87,Gifts,14,5
21676,FLOWERS  STICKERS,1.66,Toys,25,2
22166,WALL MIRROR RECTANGLE DIAMANTE PINK,7.62,Home,11,6
22194,BLACK DINER WALL CLOCK,16.98,Home,27,6
22263,FELT EGG COSY LADYBIRD ,1.66,Home,19,4
22279,POCKET BAG BLUE PAISLEY RED SPOT,2.51,Toys,13,6
22305,COFFEE MUG PINK PAISLEY DESIGN,5.06,Gifts,28,6
22346,PARTY PIZZA DISH GREEN POLKADOT,1.66,Home,12,6
22496,SET OF 2 ROUND TINS DUTCH CHEESE,5.91,Gifts,24,2
22529,MAGIC DRAWING SLATE GO TO THE FAIR ,0.85,Gifts,18,5
22564,ALPHABET STENCIL CRAFT,2.51,Home,29,5
22598,CHRISTMAS MUSICAL ZINC TREE,1.66,Stationery,17,4
22689,DOORMAT MERRY CHRISTMAS RED ,14.43,Toys,28,5
22922,FRIDGE MAGNETS US DINER ASSORTED,11.02,Stationery,12,3
22953,BIRTHDAY PARTY CORDON BARRIER TAPE,2.51,Toys,22,6
46776F,WOVEN ROSE GARDEN CUSHION COVER ,4.21,Home,22,4
48173C,DOORMAT BLACK FLOCK ,14.43,Toys,26,6
84509E,SET OF 4 CAROUSEL PLACEMATS ,7.62,Home,14,2
84510E,SET OF 4 GREEN CAROUSEL COASTERS,2.51,Stationery,13,2
84748,FOLK FELT HANGING MULTICOL GARLAND,7.62,Stationery,10,4
84968D,SET OF 16 VINTAGE RED CUTLERY,25.49,Stationery,12,2
85184C,S/4 VALENTINE DECOUPAGE HEART BOX,5.91,Gifts,13,4
90070,RUBY GLASS CLUSTER BRACELET,6.37,Gifts,22,5
90147,CHUNKY SILVER NECKLACE PASTEL FLOWE,10.62,Toys,13,5
90185B,AMETHYST DIAMANTE EXPANDABLE RING,4.24,Toys,20,2
90201C,RED ENAMEL FLOWER RING,2.96,Gifts,13,2
DOT,DOTCOM POSTAGE,847.42,Home,13,6
22607,WOODEN ROUNDERS GARDEN SET ,8.5,Home,25,4
37475,SET/4 COLOURFUL MIXING BOWLS,9.95,Gifts,14,4
84951A,SET OF 4 PISTACHIO LOVEBIRD COASTER,2.55,Stationery,26,6
84951B,SET OF 4 BLACK LOVEBIRD COASTERS,2.55,Toys,13,5
22308,TEA COSY BLUE STRIPE,2.55,Stationery,25,2
22053,EMPIRE DESIGN ROSETTE,1.25,Toys,15,4
22317,FIVE CATS HANGING DECORATION,2.95,Stationery,13,5
48116,DOORMAT MULTICOLOUR STRIPE,6.75,Home,16,5
21131,GOLD STANDING GNOME,3.75,Home,12,5
20654,FIRST CLASS LUGGAGE TAG ,1.25,Gifts,28,2
17165D,ASS COL LARGE SAND FROG P'WEIGHT,1.05,Toys,16,4
21442,GREEN BIRDHOUSE DECORATION,0.72,Toys,24,5
22291,HANGING CHICK CREAM DECORATION,1.45,Home,20,2
15058A,BLUE POLKADOT GARDEN PARASOL,7.95,Toys,17,4
20868,SILVER FABRIC MIRROR,1.25,Gifts,22,3
21189,WHITE HONEYCOMB PAPER GARLAND ,1.65,Gifts,28,6
84820,DANISH ROSE TRINKET TRAYS,5.95,Stationery,28,3
85006,SET 4 NURSERY DES ROUND BOXES,2.95,Gifts,28,2
84821,DANISH ROSE DELUXE COASTER,0.85,Gifts,20,5
84638,SMALL KITCHEN FLOWER POTS PLAQUE,6.95,Stationery,29,5
84637,KITCHEN FLOWER POTS WALL PLAQUE,5.95,Gifts,29,4
84508A,CAMOUFLAGE DESIGN TEDDY,2.1,Stationery,22,4
22229,BUNNY WOODEN PAINTED WITH FLOWER ,0.85,Gifts,20,6
16236,KITTY PENCIL ERASERS,0.21,Gifts,24,3
22228,BUNNY WOODEN PAINTED WITH BIRD ,0.85,Toys,13,4
16169P,WRAP GREEN RUSSIAN FOLKART ,0.42,Stationery,15,3
90081C,LILY BROOCH OLIVE COLOUR,4.95,Stationery,14,6
16054,POPART RECT PENCIL SHARPENER ASST,0.42,Gifts,22,4
84595E,LARGE TORTILLA DESIGN RED BOWL,3.75,Stationery,14,2
84459B,YELLOW METAL CHICKEN HEART ,1.49,Toys,12,2
35915B,BLUE KNITTED HEN ,1.65,Gifts,12,5
85086A,CANDY SPOT HEART DECORATION,0.85,Home,27,5
22628,PICNIC BOXES SET OF 3 RETROSPOT ,4.95,Toys,18,5
21781,MA CAMPAGNE CUTLERY BOX,12.75,Stationery,12,6
21261,GREEN GOOSE FEATHER CHRISTMAS TREE ,16.95,Toys,28,4
85084,HOLLY TOP CHRISTMAS STOCKING,0.85,Home,26,5
81950V,FLOWER PURPLE CLOCK W/SUCKER,0.85,Stationery,18,4
21942,SKULLS DESIGN FLANNEL,0.85,Home,25,5
17012D,ORIGAMI ROSE INCENSE/CANDLE SET ,2.55,Toys,12,2
17012B,ORIGAMI JASMINE INCENSE/CANDLE SET,2.55,Toys,20,4
17012E,ORIGAMI OPIUM INCENSE/CANDLE SET ,2.55,Home,12,2
17012F,ORIGAMI SANDLEWOOD INCENSE/CAND SET,2.55,Toys,18,3
84683,CLASSICAL ROSE CANDLESTAND,0.65,Toys,20,6
84609,TALL ROCOCO CANDLE HOLDER,8.5,Toys,28,2
84375,SET OF 20 KIDS COOKIE CUTTERS,1.95,Home,24,5
22690,DOORMAT HOME SWEET HOME BLUE ,6.75,Home,14,3
84754,S/15 SILVER GLASS BAUBLES IN BAG,1.06,Home,18,2
72351B,SET/6 PINK  BUTTERFLY T-LIGHTS,1.69,Gifts,22,4
22055,MINI CAKE STAND  HANGING STRAWBERY,1.45,Stationery,25,2
84631,FRUIT TREE AND BIRDS WALL PLAQUE,7.95,Toys,13,3
84799,SPRIG LAVENDER ARTIFICIAL FLOWER,0.42,Gifts,11,6
35004P,SET OF 3 PINK FLYING DUCKS,5.45,Toys,15,2
21454,PAINTED PINK RABBIT ,0.85,Toys,12,5
22201,FRYING PAN BLUE POLKADOT,4.25,Home,27,4
15058B,PINK POLKADOT GARDEN PARASOL,7.95,Home,27,5
22621,TRADITIONAL KNITTING NANCY,1.25,Gifts,10,5
84789,ENCHANTED BIRD PLANT CAGE,3.75,Home,11,5
22393,PAPERWEIGHT VINTAGE COLLAGE,2.55,Stationery,22,5
22391,PAPERWEIGHT HOME SWEET HOME,2.55,Gifts,26,6
21122,SET/10 PINK POLKADOT PARTY CANDLES,2.51,Home,24,5
21159,MOODY BOY  DOOR HANGER ,3.36,Home,22,4
21318,GLASS CHALICE BLUE SMALL ,3.36,Stationery,12,3
21418,STARFISH SOAP DISH,5.06,Toys,24,4
21420,OYSTER TRINKET BOX,6.77,Stationery,14,2
21428,SET3 BOOK BOX GREEN GINGHAM FLOWER ,8.47,Home,25,4
21465,PINK FLOWER CROCHET FOOD COVER,7.62,Stationery,13,6
21818,GLITTER CHRISTMAS HEART ,1.66,Gifts,17,6
21868,POTTING SHED TEA MUG,1.24,Stationery,18,3
21896,POTTING SHED TWINE,1.85,Toys,17,5
22063,CERAMIC BOWL WITH STRAWBERRY DESIGN,5.91,Toys,27,4
22127,PARTY CONES CARNIVAL ASSORTED,12.72,Stationery,11,2
22158,3 HEARTS HANGING DECORATION RUSTIC,2.94,Toys,23,3
22158,3 HEARTS HANGING DECORATION RUSTIC,5.91,Stationery,19,2
22190,LOCAL CAFE MUG,2.09,Stationery,15,4
22211,WOOD STAMP SET FLOWERS,3.36,Stationery,17,6
22286,"DECORATION , WOBBLY RABBIT , METAL ",3.36,Home,17,3
22287,"DECORATION , WOBBLY CHICKEN, METAL ",3.36,Home,19,6
22341,LOVE GARLAND PAINTED ZINC ,1.64,Stationery,23,2
22342,HOME GARLAND PAINTED ZINC ,1.64,Toys,13,3
22362,GLASS JAR PEACOCK BATH SALTS,5.91,Toys,24,4
22442,GROW YOUR OWN FLOWERS SET OF 3,16.13,Gifts,22,3
22500,SET OF 2 TINS JARDIN DE PROVENCE,11.02,Toys,11,6
22557,PLASTERS IN TIN VINTAGE PAISLEY ,1.66,Toys,19,2
22634,CHILDS BREAKFAST SET SPACEBOY ,10.0,Home,15,2
22754,SMALL RED BABUSHKA NOTEBOOK ,0.84,Toys,26,4
22821,GIFT BAG PSYCHEDELIC APPLES,1.28,Stationery,26,3
22842,BISCUIT TIN VINTAGE RED,13.57,Home,22,4
22855,FINE WICKER HEART ,1.24,Home,18,3
22931,BAKING MOULD HEART WHITE CHOCOLATE,2.54,Stationery,22,4
22933,BAKING MOULD EASTER EGG MILK CHOC,5.91,Stationery,21,5
22944,CHRISTMAS METAL POSTCARD WITH BELLS,7.5,Stationery,15,5
35004B,SET OF 3 BLACK FLYING DUCKS,5.91,Home,10,4
35609A,PINK FEATHER CHRISTMAS DECORATION,2.51,Gifts,14,4
35610C,WHITE CHRISTMAS FLOCK DROPLET ,2.51,Gifts,17,5
35648,VINTAGE BEAD PINK PURSE ,2.94,Toys,24,4
46776D,WOVEN SUNSET CUSHION COVER ,4.21,Toys,13,2
72803A,ROSE SCENT CANDLE JEWELLED DRAWER,8.47,Stationery,26,6
84688,BEACH HUT DESIGN BLACKBOARD,8.47,Gifts,27,4
84712B,PINK JEWELLED PHOTO FRAME,7.62,Gifts,26,3
84920,PINK FLOWER FABRIC PONY,7.62,Toys,22,4
84931A,PINK SCOTTIE DOG W FLOWER PATTERN,5.06,Home,29,5
84945,MULTI COLOUR SILVER T-LIGHT HOLDER,0.84,Stationery,28,6
84968E,SET OF 16 VINTAGE BLACK CUTLERY,25.49,Toys,18,2
85178,VICTORIAN SEWING KIT,1.24,Gifts,29,5
85211,S/4 GROOVY CAT MAGNETS,3.36,Home,19,6
90031,BILI NUT AND WOOD NECKLACE,5.94,Stationery,26,4
90040A,MURANO STYLE GLASS BRACELET RED,4.24,Home,16,4
90082D,DIAMANTE BOW BROOCH BLACK COLOUR,6.79,Stationery,12,4
90125B,AQUA BERTIE GLASS BEAD BAG CHARM,4.21,Gifts,29,6
90125D,PURPLE BERTIE GLASS BEAD BAG CHARM,4.21,Stationery,25,5
90175A,WHITE GLASS CHUNKY CHARM BRACELET,9.34,Home,23,2
DCGS0003,BOXED GLASS ASHTRAY,2.51,Home,19,4
DOT,DOTCOM POSTAGE,907.47,Gifts,16,3
21211,SET OF 72 SKULL PAPER  DOILIES,3.83,Toys,10,6
22078,RIBBON REEL LACE DESIGN ,4.81,Home,26,4
22328,ROUND SNACK BOXES SET OF 4 FRUITS ,6.77,Home,24,5
22691,DOORMAT WELCOME SUNRISE,16.98,Stationery,10,2
22746,POPPY'S PLAYHOUSE LIVINGROOM ,5.06,Home,18,5
47599B,BLUE PARTY BAGS ,1.69,Gifts,15,2
21166,COOK WITH WINE METAL SIGN ,1.69,Stationery,12,5
21903,MAN FLU METAL SIGN,1.85,Toys,24,5
82583,HOT BATHS METAL SIGN,1.69,Home,13,3
21165,BEWARE OF THE CAT METAL SIGN ,1.45,Toys,23,5
84596G,SMALL CHOCOLATES PINK BOWL,1.06,Stationery,10,2
84596F,SMALL MARSHMALLOWS PINK BOWL,1.06,Gifts,11,2
